Concatenate elements of a list _A_ of multiple integers to a single integer	sum(d * 10 ** i for i, d in enumerate(_A_[::-1]))
convert a list of integers into a single integer	r = int(''.join(map(str, x)))
convert a DateTime string back to a DateTime object of format _A_	datetime.strptime('2010-11-13 10:33:54.227806', _A_)
get the average of a list values for each key in dictionary _A_)	[(i, sum(j) / len(j)) for i, j in list(_A_.items())]
zip two lists _A_ and _B_ into a list of two tuples containing elements at the same index in each list	zip(_A_, _B_)
prepend string _A_ to all items in list _B_	['_A_{0}'.format(i) for i in _B_]
regex for repeating words in a string _A_	re.sub('(?<!\\S)((\\S+)(?:\\_A_+\\2))(?:\\_A_+\\2)+(?!\\S)', '\\1', _A_)
normalize a pandas dataframe _A_ by row	_A_.div(_A_.sum(axis=1), axis=0)
swap values in a tuple/list inside a list _A_	map(lambda t: (t[1], t[0]), _A_)
Swap values in a tuple/list in list _A_	[(t[1], t[0]) for t in _A_]
Find next sibling element in Python Selenium?	"driver.find_element_by_xpath(""//p[@id, 'one']/following-sibling::p"")"
find all occurrences of the pattern _A_ within _B_	re.findall(_A_, _B_)
generate the combinations of 3 from a set _A_	print(list(itertools.combinations(_A_, 3)))
add multiple columns _A_, _B_, _C_ to pandas data frame _D_ from lambda function _E_	_D_[['_A_', '_B_', '_C_']] = _D_.apply(_E_, axis=1)
BeautifulSoup search string _A_ inside tag _B_	soup.find_all(_B_, string=_A_)
Convert a datetime object _A_ into readable format _B_	_A_.strftime('_B_')
parse string _A_ to int when string contains a number	int(''.join(c for c in _A_ if c.isdigit()))
add dictionary _A_ to key _B_ of dictionary _C_	_C_[_B_].update(_A_)
transforming the string _A_ into dictionary	dict(map(int, x.split(':')) for x in _A_.split(','))
How to select element with Selenium Python xpath	"driver.find_element_by_xpath(""//div[@id='a']//a[@class='click']"")"
find rows matching `(0,1)` in a 2 dimensional numpy array _A_	np.where((_A_ == (0, 1)).all(axis=1))
How to delete a record in Django models?	SomeModel.objects.filter(id=id).delete()
build a dictionary containing the conversion of each list in list _A_ to a key/value pair as its items	dict(_A_)
convert list _A_ to dictionary having each two adjacent elements as key/value pair	dict(zip(_A_[::2], _A_[1::2]))
assign float 9.8 to variable _A_	_A_ = 9.8
"separate numbers from characters in string ""30m1000n20m"""	re.findall('(([0-9]+)([A-Z]))', '20M10000N80M')
separate numbers and characters in string _A_	re.findall('([0-9]+|[A-Z])', _A_)
separate numbers and characters in string _A_	re.findall('([0-9]+)([A-Z])', _A_)
Get a list of  words from a string _A_ removing punctuation	re.compile('\\w+').findall('_A_')
Convert string _A_ into datetime.time object	datetime.datetime.strptime(_A_, '%H:%M').time()
request url _A_ without verifying SSL certificates	requests.get(_A_, verify=False)
Extract values not equal to 0 from numpy array _A_	_A_[a != 0]
map two lists _A_ and _B_ into a dictionary	new_dict = {k: v for k, v in zip(_A_, _B_)}
map two lists _A_ and _B_ into a dictionary	dict((k, v) for k, v in zip(_A_, _B_))
map two lists _A_ and _B_ into a dictionary	dict([(k, v) for k, v in zip(_A_, _B_)])
find the string matches within parenthesis from a string _A_ using regex	m = re.search('\\[(\\w+)\\]', _A_)
Enable the SO_REUSEADDR socket option in socket object _A_ to fix the error `only one usage of each socket address is normally permitted`	_A_.setsockopt(SOL_SOCKET, SO_REUSEADDR, 1)
append the sum of each tuple pair in the grouped list _A_ and list _B_ elements to list _C_	_C_ = [(a + b) for a, b in zip(_A_, _B_)]
converting hex string _A_ to its integer representations	[ord(c) for c in _A_.decode('hex')]
sort list _A_ by second element of each tuple in ascending and third element of each tuple in descending	print(sorted(_A_, key=lambda t: (-t[2], t[0])))
get list of duplicated elements in range of 3	[y for x in range(3) for y in [x, x]]
read the contents of the file _A_ into _B_	_B_ = open(_A_).read()
divide each element in list _A_ by integer _B_	_A_[:] = [(x / _B_) for x in _A_]
python: dots in the name of variable in a format string	"""""""Name: {0[person.name]}"""""".format({'person.name': 'Joe'})"
replace white spaces in dataframe _A_ with _B_	_A_.replace(' ', _B_, regex=True)
convert date _A_ to datetime	datetime.datetime.combine(_A_, datetime.time.min)
convert tuple _A_ to string _B_	_B_ = str(_A_)
get modified time of file _A_	time.ctime(os.path.getmtime(_A_))
get creation time of file _A_	time.ctime(os.path.getctime(_A_))
get modification time of file _A_	t = os.path.getmtime(_A_)
get modification time of file _A_	os._A_.getmtime(_A_)
get modified time of file _A_	print(('last modified: %s' % time.ctime(os.path.getmtime(_A_))))
get the creation time of file _A_	print(('created: %s' % time.ctime(os.path.getctime(_A_))))
get the creation time of file _A_	return os.path.getctime(_A_)
execute os command _A_TASKKILL /F /IM firefox.exe_A_	_B___B_A_B___B_ _B___B_A_B___B_o_B___B_A_B___B_s_B___B_A_B___B_._B___B_A_B___B_s_B___B_A_B___B_y_B___B_A_B___B_s_B___B_A_B___B_t_B___B_A_B___B_e_B___B_A_B___B_m_B___B_A_B___B_(_B___B_A_B___B_'_B___B_A_B___B_T_B___B_A_B___B_A_B___B_A_B___B_S_B___B_A_B___B_K_B___B_A_B___B_K_B___B_A_B___B_I_B___B_A_B___B_L_B___B_A_B___B_L_B___B_A_B___B_ _B___B_A_B___B_/_B___B_A_B___B_F_B___B_A_B___B_ _B___B_A_B___B_/_B___B_A_B___B_I_B___B_A_B___B_M_B___B_A_B___B_ _B___B_A_B___B_f_B___B_A_B___B_i_B___B_A_B___B_r_B___B_A_B___B_e_B___B_A_B___B_f_B___B_A_B___B_o_B___B_A_B___B_x_B___B_A_B___B_._B___B_A_B___B_e_B___B_A_B___B_x_B___B_A_B___B_e_B___B_A_B___B_'_B___B_A_B___B_)_B___B_A_B___B_ _B___B_A_B___B_
split string _A_ on whitespaces using a generator	"return (x.group(0) for x in re.finditer(""[A-Za-z']+"", _A_))"
Unpack each value in list _A_ to its placeholder _B_ in string '%.2f'	""""""", """""".join(['_B_.2f'] * len(_A_))"
match regex pattern _A_ with string _B_	print(re.match(_A_, _B_).group(1))
replace parentheses and all data within it with empty string _A_ in column _B_ of dataframe _C_	_C_[_B_].str.replace('\\(.*\\)', _A_)
create a list _A_ containing elements form list _B_ if first element of list _B_ is in list _C_	_A_ = [x for x in _B_ if x[0] in _C_]
generate all possible string permutations of each two elements in list _A_	print([''.join(a) for a in combinations(_A_, 2)])
get a list of items form nested list _A_ where third element of each item contains string _B_	[x for x in _A_ if _B_ in x[2]]
Sort lists in the list _A_ by the element at index 3 of each list	_A_.sort(key=lambda x: x[3])
Log message _A_ on the root logger.	logging.info(_A_)
Return a subplot axes positioned by the grid definition `1,1,1` using matpotlib	fig.add_subplot(1, 1, 1)
Sort dictionary _A_ by value in ascending order	sorted(list(_A_.items()), key=operator.itemgetter(1))
Sort dictionary _A_ by value in ascending order	sorted(_A_, key=_A_.get)
Sort dictionary _A_ by value in descending order	sorted(_A_, key=_A_.get, reverse=True)
Sort dictionary _A_ by value in ascending order	sorted(list(_A_.items()), key=(lambda x: x[1]))
elementwise product of 3d arrays _A_ and _B_	np.einsum('ijk,ikl->ijl', _A_, _B_)
Print a string _A_ with string formatting	print('I have: {0.price}'.format(_A_))
Write a comment _A_ to a file object _B_	_B_.write('_A_')
move the last item in list _A_ to the beginning	_A_ = _A_[-1:] + _A_[:-1]
Parse DateTime object _A_ using format _B_	_A_.strftime(_B_)
Normalize line ends in a string _A_	_A_.replace('\r\n', '\n').replace('\r', '\n')
find the real user home directory using python	os.path.expanduser('~user')
index a list _A_ with another list _B_	T = [_A_[i] for i in _B_]
get a list of words _A_ of a file _B_	_A_ = open(_B_).read().split()
Get a list of lists with summing the values of the second element from each list of lists _A_	[[sum([x[1] for x in i])] for i in _A_]
summing the second item in a list of lists of lists	[sum([x[1] for x in i]) for i in data]
sort objects in `Articles` in descending order of counts of _A_	Article.objects.annotate(like_count=Count('_A_')).order_by('-like_count')
return a DateTime object with the current UTC date	today = datetime.datetime.utcnow().date()
create a list containing the multiplication of each elements at the same index of list _A_ and list _B_	[(a * b) for a, b in zip(_A_, _B_)]
fetch smilies matching regex pattern _A_ in string _B_	re.findall(_A_, _B_)
match the pattern _A_ to the string _B_	re.match(_A_, _B_)
convert a list of objects _A_ to json string _B_	_B_ = json.dumps([ob.__dict__ for ob in _A_])
create a list _A_ of _B_ zeros	_A_ = [0] * _B_
decode the string _A_  to UTF-8	_A_.decode('utf-8', 'ignore')
Match regex pattern _A_ on string _B_	re.findall(_A_, _B_)
Create a key _A_ if it does not exist in dict _B_ and append element _C_ to value.	_B_.setdefault(_A_, []).append(_C_)
Get the value of the minimum element in the second column of array _A_	_A_[np.argmin(_A_[:, (1)])]
extend dictionary _A_ with key/value pairs of dictionary _B_	_A_.update(_B_)
removing key values pairs with key _A_ from a list of dictionaries _B_	[{k: v for k, v in d.items() if k != _A_} for d in _B_]
Removing key values pairs from a list of dictionaries	[dict((k, v) for k, v in d.items() if k != 'mykey1') for d in mylist]
create 3 by 3 matrix of random numbers	numpy.random.random((3, 3))
make new column _A_ in panda dataframe by adding values from other columns _B_ and _C_	df[_A_] = df[_B_] + df[_C_]
create a list of values from the dictionary _A_ that have a key with a case insensitive match to _B_	[value for key, value in list(_A_.items()) if _B_ in key.lower()]
append a path _A_ in system path	sys.path.append('_A_')
get all digits in a string _A_ after a _B_ character	re.findall('\\d+(?=_B_^_B_]+$)', _A_)
python pickle/unpickle a list to/from a file _A_	pickle.load(open(_A_, 'rb'))
Clicking a link using selenium using python	driver.find_element_by_xpath('xpath').click()
count unique index values in column _A_ in pandas dataframe _B_	_B_.groupby(level=_A_).agg(lambda x: x.index.get_level_values(1).nunique())
Create a pandas dataframe of values from a dictionary _A_ which contains dictionaries of dictionaries	pd.concat(map(pd.DataFrame, iter(_A_.values())), keys=list(_A_.keys())).stack().unstack(0)
find out the number of non-matched elements at the same index of list _A_ and list _B_	sum(1 for i, j in zip(_A_, _B_) if i != j)
make all keys lowercase in dictionary _A_	_A_ = {(a.lower(), b): v for (a, b), v in list(_A_.items())}
sort list _A_ based on first element of each tuple and by the length of the second element of each tuple	_A_.sort(key=lambda x: [x[0], len(x[1]), x[1]])
trim whitespace in string _A_	_A_.strip()
trim whitespace (including tabs) in _A_ on the left side	_A_ = _A_.lstrip()
trim whitespace (including tabs) in _A_ on the right side	_A_ = _A_.rstrip()
trim characters _A_ in _B_	_B_ = _B_.strip(_A_)
trim whitespaces (including tabs) in string _A_	print(re.sub('[\\_A_+]', '', _A_))
In Django, filter _A_ based on all entities in [_B_, _C_, _D_]	_A_.exclude(prerequisites__status__in=[_B_, _C_, _D_])
Change background color in Tkinter	root.configure(background='black')
convert dict _A_ to numpy structured array	numpy.array([(key, val) for key, val in _A_.items()], dtype)
Concatenate dataframe _A_ to dataframe _B_ sorted by values of the column _C_	pd.concat([_A_, _B_.sort_values(_C_)])
replace the last occurence of an expression _A_ with _B_ in a string _C_	re.sub('(.*)_A_', '\\1_B_', _C_)
get the maximum of _A_ and _B_ values in a dictionary	print(max(d, key=lambda x: (d[x][_A_], d[x][_B_])))
Filter Django objects by _A_ with ids _B_ and _C_	Book.objects.filter(_A___id=_B_).filter(_A___id=_C_)
split string _A_ based on case-insensitive matching using string _B_	re.compile(_B_, re.IGNORECASE).split(_A_)
get list of sums of neighboring integers in string _A_	[sum(map(int, s)) for s in _A_.split()]
Get all the keys from dictionary _A_ whose value is _B_	[i for i in _A_ if _A_[i] == _B_]
converting byte string _A_ in unicode string	_A_.decode('unicode_escape')
unpivot first 2 columns into new columns _A_ and _B_ from a pandas dataframe _C_	pd.melt(_C_, id_vars=['farm', 'fruit'], var_name=_A_, value_name=_B_)
add key _A_ and value _B_ to dictionary `default_data `	default_data['_A_'] = _B_
add key _A_ and value _B_ to dictionary `default_data `	default_data.update({'_A_': _B_, })
add key value pairs _A_ , 4 and _B_ , 5 to dictionary _C_	_C_.update({_A_: 4, _B_: 5, })
Get the first and last 3 elements of list _A_	_A_[:3] + _A_[-3:]
reset index to default in dataframe _A_	_A_ = _A_.reset_index(drop=True)
For each index _A_ from 0 to 3, append the element at index _A_ of list _B_ to the list at index _A_ of list a.	[a[_A_].append(_B_[_A_]) for _A_ in range(3)]
get canonical path of the filename _A_	os._A_.realpath(_A_)
check if dictionary _A_ is in dictionary _B_	set(_A_).issubset(set(_B_))
find all the indexes in a Numpy 2D array where the value is 1	zip(*np.where(a == 1))
How to find the index of a value in 2d array in Python?	np.where(a == 1)
Collapse hierarchical column index to level 0 in dataframe _A_	_A_.columns = _A_.columns.get_level_values(0)
create a matrix from a list _A_	x = scipy.matrix(_A_).transpose()
add character _A_ after word _B_ in string _C_	_C_ = re.sub('(\\bget\\b)', '\\1_A_', _C_)
get a numpy array that contains the element wise minimum of three 3x1 arrays	np.array([np.arange(3), np.arange(2, -1, -1), np.ones((3,))]).min(axis=0)
add a column _A_ to dataframe _B_ for index in range	_B_[_A_] = list(range(1, len(_B_) + 1))
set environment variable _A_ equal to 1	os.environ[_A_] = '1'
Get a environment variable _A_	print(os.environ['_A_'])
set environment variable _A_ to _B_	os.environ[_A_] = _B_
update dictionary _A_, overwriting values where keys are identical, with contents of dictionary _B_	_A_.update(_B_)
get all the values in column _A_ from pandas data frame _B_	_B_['_A_']
make a line plot with errorbars, _A_, from data `x, y, err` and set color of the errorbars to _B_ (yellow)	_A_ = plt.errorbar(x, _B_, yerr=err, ecolor='_B_')
find all files with extension _A_ in directory _B_	results += [each for each in os.listdir(_B_) if each.endswith(_A_)]
add unicode string _A_ to UTF-8 decoded string _B_	print(_B_.decode('utf8') + _A_)
lower-case the string obtained by replacing the occurrences of regex pattern _A_ in string _B_ with eplacement _C_	re.sub(_A_, _C_, _B_).lower()
Setting stacksize in a python script	os.system('ulimit -s unlimited; some_executable')
format a string _A_ using string formatting	"""""""{0:.3g}"""""".format(_A_)"
append the first element of array _A_ to array _A_	numpy.append(_A_, _A_[0])
return the column for value 38.15 in dataframe _A_	_A_.ix[:, (_A_.loc[0] == 38.15)].columns
merge 2 dataframes _A_ and _B_ with same values in a column _C_ with and index _D_	_B_[_C_] = _B_.CET.map(_A_.set_index(_D_)[_C_])
load a json data _A_ into variable _B_	_B_ = json.loads(_A_)
convert radians 1 to degrees	math.cos(math.radians(1))
count the number of integers in list _A_	sum(isinstance(x, int) for x in _A_)
replacing  _A_ with _B_ in a string  using regular expressions	'used\u200b'.replace(_A_, _B_)
run function _A_ simultaneously	threading.Thread(target=_A_).start()
sum of squares values in a list _A_	sum(i * i for i in _A_)
calculate the sum of the squares of each value in list _A_	sum(map(lambda x: x * x, _A_))
Create a dictionary _A_ from list _B_	_A_ = dict(((key, value) for (key, value) in _B_))
Create a dictionary _A_ from list _B_	_A_ = {key: value for (key, value) in _B_}
Create a dictionary _A_ from list of key value pairs _B_	_A_ = {k: v for (k, v) in _B_}
round off entries in dataframe _A_ column _B_ to two decimal places, and entries in column _C_ to three decimal places	_A_.round({'_B_': 2, '_C_': 3})
Make function _A_ output nothing in curl _B_	_B_.setopt(pycurl._A_, lambda x: None)
return a random word from a word list _A_	print(random.choice(_A_))
Find a max value of the key _A_ in a nested dictionary _B_	max(_B_, key=lambda x: _B_[x]['_A_'])
get list of string elements in string _A_ delimited by commas, putting _B_ in place of empty strings	[(int(x) if x else _B_) for x in _A_.split(',')]
split string _A_ into a list of strings based on _B_ then replace empty strings with zero	""""""","""""".join(x or '0' for x in _A_.split(_B_))"
regular expression match nothing	re.compile('$^')
regular expression syntax for not to match anything	re.compile('.\\A|.\\A*|.\\A+')
create a regular expression object with a pattern that will match nothing	re.compile('a^')
drop all columns in dataframe _A_ that holds a maximum value bigger than 0	_A_.columns[_A_.max() > 0]
check if date _A_ is equal to today's date	_A_.date() == datetime.today().date()
print bold text _A_	print('\x1b[1m' + _A_)
remove 20 symbols in front of _A_ in string 'unique12345678901234567890.mkv'	re_A_sub('_A_{20}(_A_mkv)', '\\1', 'unique12345678901234567890_A_mkv')
Define a list with string values _A_	_A_
substitute multiple whitespace with single whitespace in string _A_	""""""" """""".join(_A_.split())"
print a floating point number 2.345e-67 without any truncation	print('{:.100f}'.format(2.345e-67))
Check if key _A_ in _B_	(_A_ in _B_)
Check if key _A_ in _B_	(_A_ in _B_)
Check if key _A_ in _B_	(_A_ in _B_)
Check if a given key _A_ exists in dictionary _B_	if (_A_ in _B_):<nl>    pass
Check if a given key _A_ exists in dictionary _B_	if (_A_ in _B_):<nl>    pass
create a django query for a list of values _A_	Blog.objects.filter(pk__in=[_A_])
read a binary file _A_	f = open(_A_, 'rb')
insert _A_ between every three digit before _B_ and replace _C_ with _B_ in 12345678.46	format(12345678_D_46, _C_)_D_replace(_C_, _A_)_D_replace(_B_, _C_)
Join pandas data frame _A_ and _B_ with left join by _C_ and right join by _D_	pd.merge(_A_, _B_, left_on='_C_', right_on='_D_')
calculate ratio of sparsity in a numpy array _A_	np.isnan(_A_).sum() / np.prod(_A_.shape)
reverse sort items in default dictionary _A_ by the third item in each key's list of values	sorted(iter(_A_.items()), key=lambda k_v: k_v[1][2], reverse=True)
Sort dictionary _A_ in ascending order based on second elements of its values	sorted(list(_A_.items()), key=lambda v: v[1])
reverse sort dictionary _A_ based on its values	sorted(list(_A_.items()), key=lambda k_v: k_v[1], reverse=True)
sorting a defaultdict _A_ by value	sorted(list(_A_.items()), key=lambda k_v: k_v[1])
open a file _A_ in the same directory as a python script	f = open(os.path.join(__location__, _A_))
open the file _A_ in _B_ mode	f = open(_A_, _B_)
divide the values with same keys of two dictionary _A_ and _B_	{k: (float(_B_[k]) / _A_[k]) for k in _B_}
divide the value for each key _A_ in dict _B_ by the value for the same key _A_ in dict _D_	{_A_: (_B_[_A_] / _D_[_A_]) for _A_ in list(_D_.keys()) & _B_}
divide values associated with each key in dictionary _A_ from values associated with the same key in dictionary _B_	dict((k, float(_B_[k]) / _A_[k]) for k in _B_)
write dataframe _A_ to csv file _B_ with dates formatted as yearmonthday  _C_	_A_.to_csv(_B_, date_format='_C_')
remove a key _A_ from a dictionary _B_	_B_.pop(_A_, None)
replace NaN values in array _A_ with zeros	b = np.where(np.isnan(_A_), 0, _A_)
subprocess run command _A_ through the shell	subprocess.call(_A_, shell=True)
run command _A_ on command line tools as separate processes	subprocess.call(_A_, shell=True)
replace percent-encoded code in request _A_ to their single-character equivalent	_A_ = urllib.request.urlopen(url, urllib.parse.unquote(urllib.parse.urlencode(params)))
remove white spaces from the end of string _A_	"""""_A_"""".rstrip()"
Replace special characters in utf-8 encoded string _A_ using the %xx escape	urllib.parse.quote(_A_.encode('utf-8'))
URL encoding in python	urllib.parse.quote_plus('a b')
Create an array containing the conversion of string _A_ into separate elements	np.array(map(int, _A_))
convert a string _A_ to numpy array of integer values	print(np.array(list(_A_), dtype=int))
convert an rgb image _A_ into grayscale _B_	_B_ = cv2.imread(_A_, 0)
sort list _A_ in descending order based on the second item of each tuple in it	_A_.sort(key=lambda x: x[2], reverse=True)
How to find all occurrences of an element in a list?	indices = [i for i, x in enumerate(my_list) if x == 'whatever']
execute shell command _A_ with a | pipe in it	subprocess.call(_A_, shell=True)
count the number of trailing question marks in string _A_	len(_A_) - len(_A_.rstrip('?'))
remove dollar sign _A_ from second to last column data in dataframe _B_ and convert the data into floats	_B_[df.columns[1:]].replace('[\\_A_,]', '', regex=True).astype(float)
Merge column  _A_ in dataframe _B_ with column _A_ on dataframe _C_	_C_.merge(_B_, how='left', on=_A_)
switch positions of each two adjacent characters in string _A_	print(''.join(''.join(i) for i in zip(a2, a1)) + _A_[-1] if len(_A_) % 2 else '')
make a window _A_ jump to the front	_A_.attributes('-topmost', True)
make a window _A_ jump to the front	_A_.lift()
Convert list of booleans _A_ into a hex string	hex(int(''.join([str(int(b)) for b in _A_]), 2))
convert the sum of list _A_ into a hex presentation	hex(sum(b << i for i, b in enumerate(reversed(_A_))))
print the string _A_, the value of the variable _B_, the string _C_ and the value of the variable _D_ in one print call.	print(('_A_', _B_, '_C_', _D_))
print multiple arguments _A_ and _B_.	print('Total _B_ for {} is {}'.format(_A_, _B_))
print a string using multiple strings _A_ and _B_	print('Total _B_ for %s is %s  ' % (_A_, _B_))
print string including multiple variables _A_ and _B_	print(('Total _B_ for', _A_, 'is', _B_))
serve a static html page _A_ at the root of a django project	url('^$', TemplateView.as_view(template_name=_A_))
use a list of values `[3,6]` to select rows from a pandas dataframe _A_'s column 'A'	_A_[df['A'].isin([3, 6])]
How to get the concrete class name as a string?	instance.__class__.__name__
execute python code _A_ in a virtualenv _B_ from matlab	system('_B_/bin/python _A_')
django return a QuerySet list containing the values of field _A_ in model _B_	_B_.objects.values_list(_A_, flat=True)
find all digits in string _A_ and put them to a list	re.findall('\\d|\\d,\\d\\)', _A_)
prompt string _A_ to the console	input(_A_)
print string _A_ as hex literal	"""""""_A_"""""".encode('hex')"
insert a new field _A_ on an existing document  _B_ using pymongo	db.Doc.update({'_id': _B_['_id']}, {'$set': {_A_: myGeolocCountry}})
Write a regex statement to match _A_ to 'lolllll'.	re.sub('l+', 'l', 'lollll')
BeautifulSoup find all _A_ elements in HTML string _B_ at the five stride starting from the fourth element	rows = _B_.findAll(_A_)[4::5]
reverse all x-axis points in pyplot	plt.gca().invert_xaxis()
reverse y-axis in pyplot	plt.gca().invert_yaxis()
stack two dataframes next to each other in pandas	pd.concat([GOOG, AAPL], keys=['GOOG', 'AAPL'], axis=1)
create a json response _A_	return HttpResponse(json.dumps(_A_), content_type='application/json')
decode escape sequences in string _A_	_A_.decode('string_escape')
calculate the md5 checksum of a file named  _A_	hashlib.md5(open(_A_, 'rb').read()).hexdigest()
Find all keys from a dictionary _A_ whose values are _B_	[k for k, v in _A_.items() if v == _B_]
create a set containing all keys' names from dictionary _A_	{k for d in _A_ for k in list(d.keys())}
create a set containing all keys names from list of dictionaries _A_	set([i for s in [list(d.keys()) for d in _A_] for i in s])
extract all keys from a list of dictionaries _A_	[i for s in [list(d.keys()) for d in _A_] for i in s]
unpack keys and values of a dictionary _A_ into two lists	keys, values = zip(*list(_A_.items()))
convert a string _A_ containing a decimal to an integer	int(Decimal(_A_))
Convert a string to integer with decimal in Python	int(s.split('.')[0])
check if array _A_ contains all elements of array _B_	numpy.in1d(_A_, _B_).all()
numpy:  check if array _A_ contains all the numbers in array _B_.	numpy.array([(x in _A_) for x in _B_])
Draw node labels _A_ on networkx graph `G ` at position _B_	networkx.draw_networkx__A_(G, _B_, _A_)
make a row-by-row copy _A_ of array _B_	_A_ = [row[:] for row in _B_]
Create 2D numpy array from the data provided in _A_ with each row in the file having same number of values	X = numpy.loadtxt(_A_, delimiter=',')
get a list of items from the list _A_ that contain string _B_	matching = [s for s in _A_ if _B_ in s]
export a pandas data frame _A_ to a file _B_ and retain the indices	_A_.to_csv('_B_', sep='\t')
How do I create a LIST of unique random numbers?	random.sample(list(range(100)), 10)
split a string _A_ on last delimiter	_A_.rsplit(',', 1)
Check if all elements in list _A_ are tupples of long and int	all(isinstance(x, int) for x in _A_)
check if all elements in a list _A_ are the same type _B_	all(isinstance(x, _B_) for x in _A_)
strip a string _A_ of all carriage returns and newlines	_A_.strip()
scroll to the bottom of a web page using selenium webdriver	driver.execute_script('window.scrollTo(0, Y)')
scroll a to the bottom of a web page using selenium webdriver	driver.execute_script('window.scrollTo(0, document.body.scrollHeight);')
convert Date object _A_ into a DateTime object	datetime.datetime.combine(_A_, datetime.time())
check if any item from list _A_ is in list _B_	print(any(x in _B_ for x in _A_))
save a numpy array _A_ as an image _B_	scipy.misc.imsave(_B_, _A_)
Remove anything in parenthesis from string _A_ with a regex	_A_ = re.sub(' ?\\([^)]+\\)', '', _A_)
