Filter duplicate entries w.r.t. value in _A_ from a list of dictionaries _B_	list(dict((x[_A_], x) for x in _B_).values())
Get pandas GroupBy object with sum over the rows with same column names within  dataframe _A_	_A_.groupby(_A_.columns, axis=1).sum()
convert the zip of range _A_ and range _B_ into a dictionary	dict(zip(list(range_A_), list(range_B_)))
Get all indexes of boolean numpy array where boolean value _A_ is True	numpy.where(_A_)
case insensitive comparison of strings _A_ and _B_	if (_A_.lower() == _B_.lower()):<nl>    print('The strings are the same (case insensitive)')<nl>else:<nl>    print('The strings are not the same (case insensitive)')
case insensitive string comparison between _A_ and _B_	if (_A_.lower() == _B_.lower()):<nl>    pass
case insensitive string comparison between _A_ and _B_	(_A_.lower() == _B_.lower())
case insensitive string comparison between _A_ and _B_	(_A_.lower() == _B_.lower())
case insensitive comparison between strings _A_ and _B_	(_A_.upper() == _B_.upper())
Taking the results of a bash command _A_	os.system(_A_)
remove multiple values from a list _A_ at the same time with index starting at _B_ and ending just before _C_.	del _A_[_B_:_C_]
convert a string _A_ to its base-10 representation	int(_A_.encode('hex'), 16)
match regex pattern _A_ on string _B_	re.findall(_A_, _B_)
sort a set _A_ by numerical value	sorted(_A_, key=float)
convert an int 65 to hex string	hex(65)
append a pandas series _A_ to the series _B_ and get a continuous index	_B_.append(_A_).reset_index(drop=True)
simple way to append a pandas series _A_ and _B_ with same index	pd.concat([_A_, _B_], ignore_index=True)
Get a list of tuples with multiple iterators using list comprehension	[(i, j) for i in range(1, 3) for j in range(1, 5)]
reverse sort items in dictionary _A_ by value	sorted(iter(_A_.items()), key=itemgetter(1), reverse=True)
select the last business day of the month for each month in 2014 in pandas	pd.date_range('1/1/2014', periods=12, freq='BM')
disable the certificate check in https requests for url _A_	requests.get('_A_', verify=False)
return dataframe _A_ with last row dropped	_A_.ix[:-1]
check if _A_ is in string _B_	if ('_A_' not in _B_):<nl>    pass
check if string _A_ is in _B_	if (_A_ in _B_):<nl>    pass
check if string _A_ is in string	string.find('_A_')
check if string _A_ contains _B_	"if (_A_.find('_B_') == (-1)):<nl>    print(""No '_B_' here!"")<nl>else:<nl>    print(""Found '_B_' in the string."")"
extract first and last row of a dataframe _A_	pd.concat([_A_.head(1), _A_.tail(1)])
filter a Django model _A_ to have charfield length of max `255`	_A_.objects.extra(where=['CHAR_LENGTH(text) > 254'])
Filter queryset for all objects in Django model _A_ where texts length are greater than _B_	_A_.objects.filter(text__regex='^.{_B_}.*')
count the number of rows with missing values in a pandas dataframe _A_	sum(_A_.apply(lambda x: sum(x.isnull().values), axis=1) > 0)
Sorting while preserving order in python	sorted(enumerate(a), key=lambda x: x[1])
set the font _A_ of size 12 for a canvas' text item _B_	canvas.create_text(x, y, font=(_A_, 12), text=_B_)
create a list containing all values associated with key _A_ in dictionaries of list _B_ using list comprehension	[y[_A_] for x in _B_ for y in x['bar']]
read pandas data frame csv _A_ with extra commas in column specifying string delimiter _B_	"df = pd.read_csv(_B__A__B_, quotechar=""_B_"")"
replace string _A_ with _B_ in dataframe _C_ column _D_	_C_[_D_] = _C_[_D_].str.replace(_A_, _B_)
Get all indexes of a list _A_ where each value is greater than _B_	[i for i in range(len(_A_)) if _A_[i] > _B_]
check if a local variable _A_ exists	('_A_' in locals())
check if a global variable _A_ exists	('_A_' in globals())
check if object _A_ has attribute _B_	hasattr(_A_, _B_)
check if a local variable _A_ exists	if (_A_ in locals()):<nl>    pass
check if a global variable _A_ exists	if (_A_ in globals()):<nl>    pass
lambda function that adds two operands	lambda x, y: x + y
count the number of items in a generator/iterator _A_	sum(1 for i in _A_)
get tuples of the corresponding elements from lists _A_ and _B_	[(x, _B_[i]) for i, x in enumerate(_A_)]
create tuples containing elements that are at the same index of list _A_ and list _B_	[(i, j) for i, j in zip(_A_, _B_)]
get tuples from lists _A_ and _B_ using list comprehension in python 2	[(_A_[i], _B_[i]) for i in range(len(_A_))]
convert hex triplet string _A_ to rgb tuple	struct.unpack('BBB', _A_.decode('hex'))
Check if 3 is not in a list [2, 3, 4]	(3 not in [2, 3, 4])
Check if tuple (2, 3) is not in a list [(2, 3), (5, 6), (9, 1)]	((2, 3) not in [(2, 3), (5, 6), (9, 1)])
Check if tuple (2, 3) is not in a list [(2, 7), (7, 3), _A_]	((2, 3) not in [(2, 7), (7, 3), '_A_'])
Check if 3 is not in the list [4,5,6]	(3 not in [4, 5, 6])
create a list by appending components from list _A_ and reversed list _B_ interchangeably	[value for pair in zip(_A_, _B_[::-1]) for value in pair]
delete the last column of numpy array _A_ and assign resulting array to _B_	_B_ = np.delete(_A_, -1, 1)
commit all the changes after executing a query.	dbb.commit()
join two dataframes based on values in selected columns	pd.merge(a, b, on=['A', 'B'], how='outer')
set text color as _A_ and background color as _B_ in qpushbutton	setStyleSheet('QPushButton {background-color: _B_; color: _A_;}')
find the mean of elements in list _A_	sum(_A_) / float(len(_A_))
Find all the items from a dictionary _A_ if the key contains the string _B_	[(k, v) for k, v in _A_.items() if '_B_' in k]
Get a md5 hash from string _A_	k = hashlib.md5('_A_').hexdigest()
How to get only the last part of a path in Python?	os.path.basename(os.path.normpath('/folderA/folderB/folderC/folderD/'))
sort datetime objects _A_ by _B_ and _C_	_A_.sort(key=lambda d: (d._B_, d._C_))
extract table data from table _A_ using beautifulsoup	[[td.findNext(text=True) for td in tr.findAll('td')] for tr in _A_]
strip the string _A_ from anywhere in the string `Boat.txt.txt`	"""""""Boat_A__A_"""""".replace('_A_', '')"
get a list of the row names from index of a pandas data frame	list(df.index)
get the row names from index in a pandas data frame	df.index
create a list of all unique characters in string _A_	""""""""""""".join(list(OrderedDict.fromkeys(_A_).keys()))"
get list of all unique characters in a string _A_	list(set(_A_))
List of all unique characters in a string?	""""""""""""".join(set('aaabcabccd'))"
find rows with non zero values in a subset of columns where _A_ is not equal to _B_ in pandas dataframe	df.loc[(df.loc[:, (_A_ != _B_)] != 0).any(1)]
upload file with Python Mechanize	br.form.add_file(open(filename), 'text/plain', filename)
check if  dictionary _A_ contains all keys in list _B_	all(word in _A_ for word in _B_)
hide output of subprocess _A_	subprocess.check_output(_A_, stderr=subprocess.STDOUT)
replace nans by preceding values in pandas dataframe _A_	_A_.fillna(method='ffill', inplace=True)
create 4 numbers in range between 1 and 3	print(np.linspace(1, 3, num=4, endpoint=False))
Create numpy array of _A_ numbers starting from _B_ with interval of _C_	print(np.linspace(_B_, _C_, num=_A_))
create a symlink directory _A_ for directory _B_ with unicode support using ctypes library	kdll.CreateSymbolicLinkW('_A_', '_B_', 1)
get a list _A_ of array slices of the first two rows and columns from array _B_	_A_ = [_B_[i][0:2] for i in range(0, 2)]
upload uploaded file from path _A_ to Google cloud storage _B_ bucket	upload_url = blobstore.create_upload_url(_A_, gs_bucket_name=_B_)
change directory to the directory of a python script	os.chdir(os.path.dirname(__file__))
call a function with argument list _A_	func(*_A_)
split column _A_ in dataframe _B_ into two columns by first whitespace _C_	_B_[_A_].str.split(_C_, 1, expand=True)
pandas dataframe, how do i split a column _A_ into two _B_ and _C_ on delimiter _D_	df[_B_], df[_C_] = df[_A_].str.split(_D_, 1).str
sort list _A_ based on the length of its elements	print(sorted(_A_, key=len))
sort list _A_ in ascending order of length of elements	_A_.sort(lambda x, y: cmp(len(x), len(y)))
sort list of strings _A_ by the length of string	_A_.sort(key=lambda s: len(s))
plot point marker _A_ on series _B_	_B_.plot(marker=_A_)
get all combination of n binary values	lst = list(itertools.product([0, 1], repeat=n))
get all combination of n binary values	lst = map(list, itertools.product([0, 1], repeat=n))
get all combination of 3 binary values	bin = [0, 1]<nl>[(x, y, z) for x in bin for y in bin for z in bin]
get all combination of 3 binary values	lst = list(itertools.product([0, 1], repeat=3))
append string _A_ at the beginning of each value in column _B_ of dataframe _C_	_C_[_B_] = _A_ + _C_[_B_].astype(str)
get a dict of variable names _A_ as a string and their values	dict((name, eval(name)) for name in _A_)
add a colorbar to plot _A_ using image _B_ on axes _C_	_A_.colorbar(_B_, _C_=ax)
convert nested list _A_ into a flat list	[a for c in _A_ for b in c for a in b]
create a list containing keys of dictionary _A_ and sort it alphabetically	sorted(_A_, key=_A_.get)
print the number of occurences of not `none` in a list _A_ in Python 2	print(len([x for x in _A_ if x is not None]))
lookup dictionary key _A_ in Django template _B_	{{_B_._A_}}
remove duplicates from list _A_	mynewlist = list(_A_)
get unique values from the list _A_	set(_A_)
set size of _A_ to landscape A4 i.e. _B_ inches	_A_(figsize=(_B_))
get every thing after last _A_	url.rsplit('_A_', 1)
get everything after last slash in a url stored in variable _A_	_A_.rsplit('/', 1)[-1]
open file _A_ in directory _B_	x_file = open(os.path.join(_B_, _A_), 'r')
create a list with the characters of a string _A_	list('_A_')
concatenate a list of numpy arrays _A_ together into a flattened list of values	np.concatenate(_A_).ravel().tolist()
convert dictionary _A_ into a flat list	print([y for x in list(_A_.items()) for y in x])
Convert a dictionary _A_ into a list with key and values as list items.	[y for x in list(_A_.items()) for y in x]
get a random record from model _A_ using django's orm	_A_.objects.order_by('?').first()
change current working directory to directory _A_	os.chdir(_A_)
change current working directory	os.chdir('C:\\Users\\username\\Desktop\\headfirstpython\\chapter3')
change current working directory	os.chdir('.\\chapter3')
create a flat dictionary by summing values associated with similar keys in each dictionary of list `dictlist`	dict((key, sum(d[key] for d in dictList)) for key in dictList[0])
sort pandas data frame _A_ using values from columns _B_ and _C_ in ascending order	_A_.sort(['_B_', '_C_'], ascending=[True, True])
Converting string lists _A_ to float list	floats = [float(x) for x in _A_.split()]
Converting string lists _A_ to float list	floats = map(float, _A_.split())
set labels _A_ on axis X in plot _B_	_B_.xticks(_A_)
read line by line from stdin	for line in fileinput.input():<nl>    pass
read line by line from stdin	for line in sys.stdin:<nl>    pass
check if string _A_ exists in the values of dictionary _B_	'_A_' in list(_B_.values())
Check if value _A_ is among the values of dictionary _B_	_A_ in iter(_B_.values())
call parent class _A_ of child class constructor	super(_A_, self).__init__(name, year)
create a dictionary using two lists_A_ and _B_	dict(zip(_A_, _B_))
sort a list of dictionaries _A_ by dictionary values in descending order	sorted(_A_, key=lambda i: list(i.values())[0], reverse=True)
sorting a list of dictionary _A_ by values in descending order	sorted(_A_, key=dict.values, reverse=True)
Use multiple groupby and agg operations _A_, _B_, _C_ for pandas data frame _D_	_D_.groupby(level=0).agg(['_A_', '_B_', '_C_'])
for a dictionary _A_, set default value for key _B_ as list and append value _C_  in that key	_A_.setdefault('_B_', []).append('_C_')
sum values in list of dictionaries _A_ with key _B_	sum(item[_B_] for item in _A_)
get a sum of all values from key _A_ in a list of dictionary _B_	sum([item['_A_'] for item in _B_])
Get all the values in key _A_ summed from a list of dictionary _B_	sum(item['_A_'] for item in _B_)
writing string _A_ to file _B_	_B_.write(_A_)
Write a string _A_ to a file _B_ including new line character	_B_.write('_A_\n')
find consecutive segments from a column _A_ in a pandas data frame _B_	_B_.reset_index().groupby(_A_)['index'].apply(np.array)
get a relative path of file _A_ into variable _B_	_B_ = os.path.join(os.path.dirname(__file__), _A_)
retrieve an element from a set _A_ without removing it	e = next(iter(_A_))
execute a command in the command prompt to list directory contents of the c drive `c:\\'	os.system('dir c:\\')
Make a auto scrolled window to the end of the list in gtk	self.treeview.connect('size-allocate', self.treeview_changed)
check if 3 is inside list _A_	3 in _A_
Represent DateTime object _A_ with format _B_ into format _C_	datetime.datetime.strptime(_A_, _B_).strftime(_C_)
convert a string literal _A_ with values `\\` to raw string literal	_A_ = _A_.replace('\\', '\\\\')
get output of script _A_	print(_A_.communicate()[0])
create a pandas data frame from list of nested dictionaries _A_	pd.concat([pd.DataFrame(l) for l in _A_], axis=1).T
delete all columns in  DataFrame _A_ that do not hold a non-zero value in its records	_A_.loc[:, ((_A_ != 0).any(axis=0))]
sort a multidimensional array _A_ by column with index 1	sorted(_A_, key=lambda x: x[1])
split string _A_ to list conversion by _B_	[x.strip() for x in _A_.split(_B_)]
Get a list of items in the list _A_ with attribute equal to _B_	items = [item for item in _A_ if item.attribute == _B_]
create a file _A_ with each tuple in the list _B_ written to a line	open(_A_, 'w').write('\n'.join('%s %s' % x for x in _B_))
Get multiple matched strings using regex pattern _A_	pattern = re.compile('_A_', re.IGNORECASE)
read a text file _A_ into a string variable _B_	_B_ = open(_A_, 'r').read()
Return values for column _A_ after group by on column _B_ and _C_ in dataframe _D_	_D_.groupby(['__C__', '_C_'])['___C___'].unique()
read file _A_ line by line into a list _B_	with open(_A_) as f:<nl>    _B_ = f.readlines()
read file _A_ line by line into a list _B_	with open(_A_) as f:<nl>    _B_ = f.readlines()
read file _A_ line by line into a list _B_	_B_ = [line.rstrip('\n') for line in open(_A_)]
read file _A_ line by line into a list _B_	with open('_A_', 'r') as ins:<nl>    _B_ = []<nl>    for line in ins:<nl>        _B_.append(line)
convert the dataframe column _A_ from string types to datetime types	df[_A_] = pd.to_datetime(df[_A_])
get a list of the keys in each dictionary in a dictionary of dictionaries _A_	[k for d in list(_A_.values()) for k in d]
get user input using message _A_ and insert it to the first placeholder in string _B_	print(_B_.format(input(_A_)))
create pandas data frame _A_ from txt file _B_ with column _C_ and separator _D_	_A_ = pd.read_csv('_B_', sep='_D_', names=['_C_'])
Pandas: How can I use the apply() function for a single column?	df['a'] = df['a'].apply(lambda x: x + 1)
get the platform OS name	platform.system()
sort list _A_ in ascending order based on its elements' float values	_A_ = sorted(_A_, key=lambda x: float(x))
finding words in string _A_ after keyword _B_	re.search('_B_ (.*)', _A_)
Find all records from collection _A_ without extracting mongo id _B_	db._A_.find({}, {'_B_': False})
Get all the second values from a list of lists _A_	[row[1] for row in _A_]
extract first column from a multi-dimensional array _A_	[row[0] for row in _A_]
sort list _A_ in ascending order based on the integer value of its elements	sorted(_A_, key=int)
check if file _A_ is descendant of directory _B_	os.path.commonprefix([_B_, os.path.realpath(_A_)]) == _B_
check if any element of list _A_ are in string _B_	any(substring in _B_ for substring in _A_)
construct pandas dataframe from a list of tuples	df = pandas.DataFrame(data, columns=['R_Number', 'C_Number', 'Avg', 'Std'])
find and replace 2nd occurrence of word _A_ by _B_ in a sentence _C_	re.sub('^((?:(?!_A_).)*_A_(?:(?!_A_).)*)_A_', '\\1Bull', _C_)
find and replace 2nd occurrence of word _A_ by _B_ in a sentence _C_	re.sub('^((.*?_A_.*?){1})_A_', '\\1Bull', _C_)
sort list of strings in list _A_ by integer suffix	sorted(_A_, key=lambda k: int(k.split('_')[1]))
sort list of strings _A_ by integer suffix before _B_	sorted(_B_A_B_, key=lambda x: int(x.split('_B_')[1]))
make a list of lists in which each list _A_ are the elements from list _B_ which have the same characters up to the first _C_ character	[list(_C_A_C_) for _C_, _C_A_C_ in itertools.groupby(_C_B_C_, lambda x: x.split('_C_')[0])]
How to group similar items in a list?	[list(g) for _, g in itertools.groupby(test, lambda x: x.partition('_')[0])]
Load the url _A_ in selenium webdriver _B_	_B_.get('_A_')
using python's datetime module, get the year that utc-11 is currently in	(datetime.datetime.utcnow() - datetime.timedelta(hours=11)).year
Get the difference between two lists _A_ and _B_ that may have duplicate values	Counter(_A_) - Counter(_B_)
remove tags from a string _A_	re.sub('<[^>]*>', '', _A_)
encode string _A_ as _B_	_A_.encode('_B_')
filter `Users` by field _A_ with level greater than or equal to _B_	User.objects.filter(_A___level__gte=_B_)
BeautifulSoup find a tag whose id ends with string _A_	soup.findAll(id=re.compile('_A_$'))
select _A_ tags whose _B_s begin with _C_	"soup.select('_A_[_B_^=""_C_""]')"
delete an item _A_ in a list _B_ if it exists	cleaned_list = [x for x in _B_ if x is not _A_]
print _A_ to console, and read user input to _B_	_B_ = input('_A_')
append 4 to list _A_	_A_.append(4)
append a list [8, 7] to list _A_	_A_.append([8, 7])
insert 77 to index 2 of list _A_	_A_.insert(2, 77)
remove white space padding around a saved image _A_ in matplotlib	plt.savefig('_A_', bbox_inches='tight')
concatenate lists _A_ and _B_	(_A_ + _B_)
iterate items in lists _A_ and _B_	for item in itertools.chain(_A_, _B_):<nl>    pass
create dataframe _A_ containing data of dataframe _B_ where column _C_ is equal to _D_ and column _E_ is equal to 2014	_A_ = _B_[(_B_[_C_] == _D_) & (_B_[_E_] == 2014)]
print backslash	print('\\')
replace _A_ in pandas dataframe _B_ with _C_	_B_.replace(_A_, _C_)
delete column _A_ from dataframe _B_	_B_ = _B_.drop(_A_, 1)
delete 1st, 2nd and 4th columns from dataframe _A_	_A_.drop(_A_.columns[[0, 1, 3]], axis=1)
delete a column _A_ without having to reassign from pandas data frame _B_	_B_.drop('_A_', axis=1, inplace=True)
disable abbreviation in argparse	parser = argparse.ArgumentParser(allow_abbrev=False)
extract dictionary values by key _A_ from data frame _B_	feature3 = [d.get(_A_) for d in _B_.dic]
get data of column _A_ and column _B_ in dataframe _C_ where column _A_ is equal to _E_	_C_.loc[gb.groups[_E_], (__D__, _B_)]
print '[1, 2, 3]'	print('[%s, %s, %s]' % (1, 2, 3))
Display `1 2 3` as a list of string	print('[{0}, {1}, {2}]'.format(1, 2, 3))
get values from a dictionary _A_ whose key contains the string _B_	[v for k, v in list(_A_.items()) if '_B_' in k]
Python date string formatting	"""""""{0.month}/{0.day}/{0.year}"""""".format(my_date)"
drop a single subcolumn _A_ in column _B_ from a dataframe _C_	_C_.drop((_B_, _A_), axis=1)
dropping all columns named _A_ from a multiindex _B_, across all level.	_B_.drop(_A_, level=1, axis=1)
build dictionary with keys of dictionary _A_ as keys and values of returned value of function _B_ with correlating key as parameter	{_key: _B_(_key) for _key in _A_}
click on the text button _A_ using selenium python	browser.find_element_by_class_name(_A_).click()
combine two dictionaries `d ` and _A_, concatenate string values with identical _B_	dict((k, d.get(k, '') + _A_.get(k, '')) for k in _B_)
generate unique equal hash for equal dictionaries _A_ and _B_	hash(pformat(_A_)) == hash(pformat(_B_))
convert nested list of lists _A_ into a list of tuples	list(map(tuple, _A_))
sum the column _A_ along the  other columns _B_, _C_, _D_ in a pandas data frame _E_	_E_.groupby(['_B_', '_C_', '_D_'], as_index=False)['_A_'].sum()
Summing across rows of Pandas Dataframe	df.groupby(['stock', 'same1', 'same2'])['positions'].sum().reset_index()
change string _A_ to upper case	_A_.upper()
split a string _A_ by _B_ and convert to a dictionary	dict(item.split('=') for item in _A_.split(_B_))
Add header _A_ to mechanize browser _B_	_B_.addheaders = [_A_]
set data in column _A_ of dataframe _B_ equal to first element of each list	_B_[_A_] = _B_[_A_].str[0]
get element at index 0 of each list in column _A_ of dataframe _B_	_B_[_A_] = _B_[_A_].str.get(0)
remove square bracket _A_ from pandas dataframe _B_ column _C_	_B_[_C_] = _B_[_C_].str.strip(_A_)
Get a string with string formatting from dictionary _A_	""""""", """""".join(['{}_{}'.format(k, v) for k, v in _A_.items()])"
Sum of sums of each list, in a list of lists named _A_.	sum(sum(x) for x in _A_)
Check whether a numpy array _A_ contains a given row _B_	any(np.equal(_A_, _B_).all(1))
check if all elements in list _A_ are the same	len(set(_A_)) == 1
split a string _A_ at line breaks _B_	[map(int, x.split('\t')) for x in _A_.rstrip().split('_B_')]
sort a dictionary _A_ by values that are list type	t = sorted(list(_A_.items()), key=lambda x: x[1])
Search for string _A_ in txt file _B_	if (_A_ in open(_B_).read()):<nl>    pass
Search for string _A_ in txt file _B_	f = open(_B_)<nl>s = mmap.mmap(f.fileno(), 0, access=mmap.ACCESS_READ)<nl>if (s.find(_A_) != (-1)):<nl>    pass
Search for string _A_ in txt file _B_	datafile = file(_B_)<nl>found = False<nl>for line in datafile:<nl>    if (_A_ in line):<nl>        return True<nl>return False
insert string _A_ after each character of _B_	_B_.replace('', _A_)[len(_A_):-len(_A_)]
getting every possible combination of two elements in a list	list(itertools.combinations([1, 2, 3, 4, 5, 6], 2))
get a utf-8 string literal representation of byte string _A_	"""""""_A_ = {}"""""".format(_A_.decode('utf8')).encode('utf8')"
check if _A_ is an integer	isinstance(_A_, int)
check if _A_ is an integer	(type(_A_) == int)
play the wav file _A_	winsound.PlaySound(_A_, winsound.SND_FILENAME)
create a list containing the _A_ next values of generator _B_	[next(_B_) for _ in range(_A_)]
get list of n next values of a generator _A_	list(itertools.islice(_A_, 0, n, 1))
compare two lists in python _A_ and _B_ and return matches	set(_A_).intersection(_B_)
How can I compare two lists in python and return matches	[i for i, j in zip(a, b) if i == j]
convert list _A_ into a string of its elements	print(''.join(map(str, _A_)))
match regex pattern _A_ on string _B_	re.match(_A_, _B_)
import a nested module `c.py` within _A_ within _B_ with importlib	importlib.import_module('.c', '_B_._A_')
import a module _A_ with importlib.import_module in python 2	importlib.import_module(_A_)
Convert array _A_ to numpy array	_A_ = np.array(_A_)
Find all _A_ tags whose classes has the value _B_ in a beautiful soup object _C_	_C_.find_all('_A_', class_=re.compile('_B_'))
a sequence of empty lists of length _A_	[[] for _ in range(_A_)]
create dictionary from list of variables _A_ and _B_ already defined	dict((k, globals()[k]) for k in (_A_, _B_))
get two random records from model _A_ in Django	_A_.objects.order_by('?')[:2]
Print a dictionary _A_ with string formatting	"""""""Hello {user[name]}"""""".format(**_A_)"
create a dictionary _A_ containing each tuple in list _B_ as values and the tuple's first element as the corresponding key	_A_ = {t[0]: t for t in _B_}
Generate a random integer between 0 and 9	randint(0, 9)
Generate a random integer between _A_ and _B_	random.randint(_A_, _B_)
Generate random integers between 0 and 9	print((random.randint(0, 9)))
reverse a string _A_ by 2 characters at a time	""""""""""""".join(reversed([_A_[i:i + 2] for i in range(0, len(_A_), 2)]))"
transform time series _A_ into a pivot table aggregated by column _B_ using column `df.index.date` as index and values of column `df.index.time` as columns	pd.pivot_table(_A_, index=_A_.index.date, columns=_A_.index.time, values=_B_)
check if the third element of all the lists in a list _A_ is equal to zero.	any(item[2] == 0 for item in _A_)
Find all the lists from a lists of list _A_ if third element in all sub-lists is _B_	[x for x in _A_ if x[2] == _B_]
sort dictionary of dictionaries _A_ according to the key _B_	sorted(list(_A_.items()), key=lambda x: x[1][_B_], reverse=True)
plot a data logarithmically in y axis	plt.yscale('log', nonposy='clip')
extract digits in a simple way from a python string	map(int, re.findall('\\d+', s))
list the contents of a directory _A_	os.listdir(_A_)
list all the contents of the directory _A_.	os.listdir(_A_)
merge a pandas data frame _A_ and column _B_ in pandas data frame _C_ into single	pd.concat([_A_, _C_._B_], axis=1)
get value of first index of each element in list _A_	[x[0] for x in _A_]
python how to get every first element in 2 dimensional list _A_	[i[0] for i in _A_]
remove line breaks from string _A_ using regex	re.sub('(?<=[a-z])\\r?\\n', ' ', _A_)
Open gzip-compressed file encoded as utf-8 _A_ in text mode	gzip.open(_A_, 'rt', encoding='utf-8')
test if either of strings _A_ or _B_ are members of the set of strings, `['b', 'a', 'foo', 'bar']`	set(['_A_', '_B_']).issubset(['_B_', '_A_', 'foo', 'bar'])
Check if all the values in a list _A_ are present in another list _B_	all(x in _B_ for x in _A_)
Remove characters _A_ from a string _B_	_B_.translate(None, '_A_')
Remove characters _A_ from a string _B_	_B_ = re.sub('[_A_]', '', _B_)
Remove string _A_ from string _B_	_B_.replace('_A_', '')
Remove character _A_ from a string _B_	_B_ = _B_.replace(_A_, '')
Remove characters in `b` from a string _A_	_A_ = _A_.replace(char, '')
