xを整数に変換する	int(x)
ヒストグラムをアクア色で描画する	plt.hist(データ列, color='aqua')
散布図の色を赤にする	plt.scatter(データ列x, データ列y, color='red')
折れ線グラフの菱形マーカーを赤色にする	plt.plot(データ列x, データ列y, marker='D', markerfacecolor='r')
スチールブルー色の棒グラフを描画する	plt.bar(データ列x, データ列y, color='steelblue')
ヒストグラムをミントクリーム色を用いて描画する	plt.hist(データ列, color='mintcream')
イテラブルにシーケンスを続けたイテラブル	itertools.chain(iterable, iterable2)
折れ線グラフに赤い右三角マーカーを描画する	plt.plot(データ列x, データ列y, marker='>', markerfacecolor='r')
折れ線グラフの丸マーカーを青くする	plt.plot(データ列x, データ列y, marker='o', markerfacecolor='b')
折れ線グラフのバツマーカーの太さを変更する	plt.plot(データ列x, データ列y, marker='x', markeredgewidth=2.5)
折れ線グラフに黒い四角印を描画する	plt.plot(データ列x, データ列y, marker='s', markerfacecolor='k')
データフレームを欠損値を含めて列の値でグループ化する	df.groupby(column, dropna=False)
棒グラフをライトスカイブルー色で描画する	plt.bar(データ列x, データ列y, color='lightskyblue')
散布図の色をダークマゼンタにする	plt.scatter(データ列x, データ列y, color='darkmagenta')
option: マーカーを左三角に変更する	marker = '<'
データフレームの列の各データ値の出現回数を求める	df[col].value_counts()
タプルの中の最大値	max(aTuple)
option: ダークオリーブグリーンにグラフの色を設定する	color = 'darkolivegreen'
データフレームの列がx以上の行を抽出する	df[df[column] >= x]
データフレームのn行目を削除する	df.drop(n, axis=0)
データフレームの中で何行、重複するか調べる	df.duplicated().sum()
ヒストグラムをライトサーモン色で描画する	plt.hist(データ列, color='lightsalmon')
折れ線グラフをプラム色で描画する	plt.plot(データ列x, データ列y, color='plum')
タイムスタンプデータをn分前に戻す	aDatetime - datetime.timedelta(minutes=n)
双方向キュー中の要素の数をカウントする	deq.count(element)
option: 追加用に設定する	mode = 'a'
２つの配列を行方向に連結する	np.concatenate([aArray, aArray2], axis=1)
追加できるように文字列の示すエンコーディングで既存のファイルを開く]	open(filepath, mode='a', encoding=s)
option: フクシアにグラフの色を設定する	color = 'fuchsia'
datetimeをインスタンス化する	datetime.datetime(年, 月, 日, 時, 分, 秒)
データフレームのカラムのタイムゾーンを日本に指定する	df[col].tz_convert('Asia/Tokyo')
ヒストグラムをシーグリーン色で描画する	plt.hist(データ列, color='seagreen')
データフレームをTSVから読み込む	pd.read_csv(filename, sep='\t')
option: ダークシアグリーン色を使う	color = 'darkseagreen'
option: 整数型を用いる	dtype = np.int
シーケンスから重複を取り除く	set(iterable)
列の値でデータフレームをグループ化して、グループごとの合計を求める	df.groupby(column).sum()
実数のアークサイン	math.asin(x)
散布図の色をサドルブラウンにする	plt.scatter(データ列x, データ列y, color='saddlebrown')
実数の逆双曲線正接を求める	math.atanh(x)
縦棒グラフをゲインズボロ色で描画する	plt.bar(データ列x, データ列y, color='gainsboro')
値を双方向キューから取り除く	deq.remove(element)
自然数最小公倍数	math.lcm(n, n2)
文字列の中のASCII限定としてパターンによる全てのマッチを使う	re.findall(pattern, s, flags=re.ASCI)
データ列間の平均二乗誤差を算出する	sklearn.metrics.mean_squared_error(データ列, データ列2)
タプルの末尾を除く	aTuple[:-1]
アイボリー色を使って横棒グラフを描画する	plt.barh(データ列x, データ列y, color='ivory')
浮動小数点数の最大値	sys.float_info.max
棒グラフをカーキ色で描画する	plt.bar(データ列x, データ列y, color='khaki')
実数のn乗して実数による余り	pow(x, n, y)
辞書をインデント幅nのJSON形式の文字列に変換する	json.dumps(aDict, ensure_ascii=False, indent=n)
グラフを画像ファイルとして保存する	plt.savefig('foo.png')
ミスティローズ色の横棒グラフを描画する	plt.barh(データ列x, データ列y, color='mistyrose')
スノー色のヒストグラムを描画する	plt.hist(データ列, color='snow')
文字列中のタブ文字を空白に置き換える	s.expandtabs(tabsize=n)
option: チョコレートにグラフの色を設定する	color = 'chocolate'
横棒グラフの色をブラックにする	plt.barh(データ列x, データ列y, color='black')
折れ線グラフにクロスマーカーを使用する	plt.plot(データ列x, データ列y, marker='x')
データフレームの列をヒストグラムにする	plt.hist(df[column])
スラグレーにヒストグラムの色を変更する	plt.hist(データ列, color='slategray')
リストとリストについての散布図に上三角マーカーを描画する	plt.plot(データ列x, データ列y, marker='^')
データフレームのn行目まで取り出す	df[:n]
赤色の散布図を描画する	plt.scatter(データ列x, データ列y, color='red')
インディゴ色を用いてヒストグラムを描画する	plt.hist(データ列, color='indigo')
ペルー色の棒グラフを描画する	plt.bar(データ列x, データ列y, color='peru')
データフレームの指定した列を配列に変換する	df[column].values
折れ線グラフにダイアモンド印を加える	plt.plot(データ列x, データ列y, marker='D')
棒グラフをシャルトリューズ色で描画する	plt.bar(データ列x, データ列y, color='chartreuse')
にバイオリン図としてデータフレームを可視化する	sns.violinplot(x='カテゴリ列', y='列', data=df)
パレットトルコイズ色として棒グラフを描画する	plt.bar(データ列x, データ列y, color='paleturquoise')
円グラフにラベルを付ける	plt.pie(データ列, startangle=90, labels=ラベル列)
要素が集合のメンバーか調べる	element in aSet
文字列の中でASCII限定として正規表現にマッチした全ての文字列をリストにする	re.findall(pattern, s, flags=re.ASCI)
スタッキングでクラス分類を行う	sklearn.ensemble.StackingClassifier()
標準出力のバッファを即時表示する	sys.stdout.flush()
左三角印で散布図を描画する	plt.scatter(データ列x, データ列y, marker='<')
グラフの凡例の位置を(x,y)に指定する	plt.legend(loc=(x, y))
option: ブラックにフォントの色を設定する	color = 'black'
データフレームのリストカラムの欠損値を平均値に設定する	df[aList].fillna(df[aList].mean())
option: インディアンレッド色を用いる	color = 'indianred'
ターコイズ色で散布図を描画する	plt.scatter(データ列x, データ列y, color='turquoise')
二つのカウンタの共通する要素	aCounter & aCounter2
変数を太字で表示できる文字列に変換する	f'\033[1m{value}\033[0m'
日付時刻データは何秒か知る	aDatetime.second
文字列の中のケースを無視してパターンによる全マッチを見る	re.findall(pattern, s, flags=re.IGNORECASE)
データフレームを'A'列によって昇順にソートする	df.sort_values(by='A', ascending=True)
option: 読み込み用に設定する	mode = 'r'
散布図を赤い▼マーカーで描画する	plt.plot(データ列x, データ列y, marker='v', c='r')
ピンク色の棒グラフを描画する	plt.bar(データ列x, データ列y, color='pink')
２つの文字列をコロンで区切ってプリントする	print(value, value2, sep=':')
折れ線グラフの色をダークレッドにセットする	plt.plot(データ列x, データ列y, color='darkred')
option: ポイントマーカーを使用する	marker = '.'
データフレームのリストカラムの中にある文字列の合計を数える	df[aList].isin([value]).sum()
赤い星マーカーで散布図を描画する	plt.plot(データ列x, データ列y, marker='*', c='r')
折れ線グラフの右三角印の色を指定する	plt.plot(データ列x, データ列y, marker='>', markerfacecolor='#800080')
ヒストグラムの色をやわらかい青に設定する	plt.hist(データ列, color='cornflowerblue')
ラベンダー色のヒストグラムを描画する	plt.hist(データ列, color='lavender')
実数の天井	math.ceil(x)
棒グラフの色をダークオリーブグリーンにする	plt.bar(データ列x, データ列y, color='darkolivegreen')
散布図をディムグレー色で描画する	plt.scatter(データ列x, データ列y, color='dimgrey')
オーキッド色として散布図を描画する	plt.scatter(データ列x, データ列y, color='orchid')
ヒストグラムの色をグリーンにセットする	plt.hist(データ列, color='green')
日付時刻データををn時間後に進める	aDatetime + datetime.timedelta(hours=n)
リストとリストについての散布図に星マーカーを描画する	plt.plot(データ列x, データ列y, marker='*')
配列と同じ大きさの空配列を作る	np.empty_like(aArray)
要素がセットのメンバー	element in aSet
option: グラフの色をライムに設定する	color = 'lime'
折れ線グラフをミディアムターコイズ色で描画する	plt.plot(データ列x, データ列y, color='mediumturquoise')
イテラブルの長さを制限する	collections.deque(iterable, maxlen=n)
データフレームをJSONLファイルに行を付けずに保存する	df.to_csv(filename, index=None)
折れ線グラフの△マーカーを青色にする	plt.plot(データ列x, データ列y, marker='^', markerfacecolor='b')
部分文字列で部分文字列が始まるか	s.startswith(sub)
破線にヒストグラムを指定する	plt.hist(データ列, linestyle='dashed')
ヒストグラムをライトシアン色として描画する	plt.hist(データ列, color='lightcyan')
リストとイテラブルについての散布図にrgbの下三角マーカーをプロットする	plt.plot(データ列x, データ列y, marker='v', c=rgb)
データフレームのカラムが正規分布からどの程度尖っているか見る	df[col].skew()
文字列を最後の部分文字列で二分し前半の文字列を使う	s.rpartition(sub)[0]
散布図の丸マーカーの太さを変える	plt.scatter(データ列x, データ列y, marker='o', markeredgewidth=2.5)
グリッド線を白くする	plt.grid(color='w')
棒グラフの色をモカシンにする	plt.bar(データ列x, データ列y, color='moccasin')
線グラフをクリムゾン色を用いて描画する	plt.plot(データ列x, データ列y, color='crimson')
二つの集合の和集合を求める	aSet.union(aSet2)
データを最大最小値で標準化する	sklearn.preprocessing.MinMaxScaler().fit_transform(データ)
リストとイテラブルについての散布図に右三角マーカーを描画する	plt.plot(データ列x, データ列y, marker='>')
二つのカウンタの共通するデータ	aCounter & aCounter2
year年month月を日付に変換する	datetime.date(year=year, month=month, day=1)
インディゴ色の横棒グラフを描画する	plt.barh(データ列x, データ列y, color='indigo')
数値を変数についてn階微分する	sympy.diff(e, z, n)
文字列の両端から空白を除去する	s.strip()
色付きの一点鎖線としてラインを描く	plt.plot(データ列x, データ列y, linestyle='dashbot', color='#800080')
1からnまでの整数列	list(range(1, n+1))
オーキッド色の横棒グラフを描画する	plt.barh(データ列x, データ列y, color='orchid')
チョコレートにヒストグラムの色を設定する	plt.hist(データ列, color='chocolate')
option: ネイビー色を用いる	color = 'navy'
四角マーカーとして散布図をプロットする	plt.plot(データ列x, データ列y, marker='s')
配列の合計値	np.sum(aArray)
散布図の色をミディアムバイオレットレッドにする	plt.scatter(データ列x, データ列y, color='mediumvioletred')
散布図の色をスカイブルーにする	plt.scatter(データ列x, データ列y, color='skyblue')
ヒストグラムの色をシャルトリューズに指定する	plt.hist(データ列, color='chartreuse')
option: グラフの色をミスティローズに指定する	color = 'mistyrose'
既存の配列を元に全要素が1の配列	np.ones_like(aArray)
散布図に青い下三角マーカーを描画する	plt.scatter(データ列x, データ列y, marker='v', markerfacecolor='b')
要素ひとつのりスト	[element]
ヒストグラムの線種を点線に指定する	plt.hist(データ列, linestyle='dotted')
散布図の色をサーモンにする	plt.scatter(データ列x, データ列y, color='salmon')
データフレームから指定されたデータ型の列名の一覧を見る	df.select_dtypes(型).columns
散布図にrgbのダイアモンドマーカーを使う	plt.plot(データ列x, データ列y, marker='D', c=rgb)
ライトスレイグレー色の散布図を描画する	plt.scatter(データ列x, データ列y, color='lightslategrey')
データ列のメディアンを算出する	ds.median()
パールゴールデンロッド色のヒストグラムを描画する	plt.hist(データ列, color='palegoldenrod')
アクア色で横棒グラフを描画する	plt.barh(データ列x, データ列y, color='aqua')
option: グラフの色をオーキッドに設定する	color = 'orchid'
折れ線グラフに青い大バツマーカーを描画する	plt.plot(データ列x, データ列y, marker='X', markerfacecolor='b')
表データを列によってグループ化して、グループごとの最小値を求める	df.groupby(column).min()
データ列の欠損値を最大値に設定する	ds.fillna(ds.max())
文字列は数値か調べる	s.isnumeric()
ライトグレー色で横棒グラフを描画する	plt.barh(データ列x, データ列y, color='lightgray')
ライム色の線グラフを描画する	plt.plot(データ列x, データ列y, color='lime')
option: グラフの色をディムグレーに設定する	color = 'dimgray'
リネン色を用いて折れ線グラフを描画する	plt.plot(データ列x, データ列y, color='linen')
option: マーカーの色をグレーにする	markerfacecolor = 'grey'
真スーパーセットか調べる	aSet > aSet2
整数nの十六進数表現	hex(n)
双方向キューの長さ	len(deq)
文字列の開始位置からと終了位置の間に部分文字列が含まれるか調べる	s.find(sub, start, end) != -1
折れ線グラフの色を真紅に設定する	plt.plot(データ列x, データ列y, color='crimson')
数に実数を加える	x + y
タプルの中の最小値	min(aTuple)
Pandasで、データフレームのcollを日付データにする	pd.to_datetime(df[col])
上位集合か調べる	aSet.issuperset(aSet2)
SDGでクラス分類を行う	model = sklearn.linear_model.SGDClassifier()
散布図に黒い下三角マーカーを描画する	plt.scatter(データ列x, データ列y, marker='v', markerfacecolor='k')
predicateFuncがTrueとならない列の要素	itertools.dropwhile(predicateFunc, iterable)
rgbの四角マーカーを散布図に用いる	plt.plot(データ列x, データ列y, marker='s', c=rgb)
マップのキーの一覧	aDict.keys()
横棒グラフの色をミディアムパープルにする	plt.barh(データ列x, データ列y, color='mediumpurple')
ビンを設定してヒストグラムを描く	plt.hist(データ列, bins=区関数)
ヒストグラムの区間数を変更する	plt.hist(データ列, bins=区関数)
ラベンダーブラッシュ色として散布図を描画する	plt.scatter(データ列x, データ列y, color='lavenderblush')
option: 右三角マーカーを使う	marker = '>'
辞書からキーの値か、もしくは要素を得る	aDict.get(key, element)
折れ線グラフの色をアリスブルーに変更する	plt.plot(データ列x, データ列y, color='aliceblue')
クラス分類のリコールを求める	sklearn.metrics.recall_score(正解データ列, 予測データ列)
リストを等間隔でn個に分割してnamesのラベルをつける	pd.cut(aList, n, labels=names)
ケンドール相関係数としてデータフレームの相関行列	df.corr(method='kendall')
データフレームの中に文字列と日付データがいくつ存在するか数える	df.isin([value, value2]).sum()
option: ASCII文字に限定する	flag = re.ASCII
データフレームのリスト列の欠損値を最小値で置き換える	df[aList].fillna(df[aList].min())
グリッド線を赤くする	plt.grid(color='r')
線形回帰分析の準備をする	model = sklearn.linear_model.LinearRegression()
option: 下三角マーカーを描画する	marker = 'v'
ファイルパスから読み込みストリームをオープンして]、fとする	f = open(filepath, mode='r')
中央値で配列を分割する	pd.qcut(aArray, 2)
文字列をパターンで区切る	re.split(pattern, s)
散布図の色をライトグリーンにする	plt.scatter(データ列x, データ列y, color='lightgreen')
折れ線グラフの色をモカシンに設定する	plt.plot(データ列x, データ列y, color='moccasin')
option: マーカーの色をダークグレーにする	markerfacecolor = 'darkgray'
散布図の色をグリーンにする	plt.scatter(データ列x, データ列y, color='green')
データフレームの散布図に多項式回帰を加える	sns.regplot(data=df, x='列名', y='列名', order=2)
データフレームを小数点以下n桁で丸める	df.round(n)
新しい文字列で文字列中の正規表現を置き換える	re.sub(pattern, newsub, s)
実数を小数点以下で丸める	round(x, n)
パウダーブルー色でヒストグラムを描画する	plt.hist(データ列, color='powderblue')
散布図を三角マーカーとして描く	plt.plot(データ列x, データ列y, marker='^')
TSVファイルからデータフレームを読み込む	pd.read_csv(filename, sep='\t', encoding='utf-8')
分割数nでデータフレームの中の列をビン分割して、namesのラベルをつける	pd.cut(df[col], n, labels=names)
データ列のエポック秒から日付データに変換する	pd.to_datetime(ds, unit='s', utc=True)
配列の相関係数を見る	scipy.stats.pearsonr(データ列, データ列2)
nが5で割り切れるか調べる	n % 5 == 0
リストとリストについて散布図を描画して、大バツマーカーの色をrgbに設定する	plt.plot(データ列x, データ列y, marker='X', c=rgb)
日付時刻データをn日前に戻す	aDatetime - datetime.timedelta(days=n)
rgbの△マーカーで散布図を描画する	plt.plot(データ列x, データ列y, marker='^', c=rgb)
散布図を白くする	plt.scatter(データ列x, データ列y, color='w')
日付データにn秒分、加える	aDate + datetime.timedelta(seconds=n)
numpyを用いる	import numpy as np
文字列のの開始位置から終了位置までの間に部分文字列がいくつか含まれるか調べる	s.count(sub, start, end)
コーンフラワーブルー色で縦棒グラフを描画する	plt.bar(データ列x, データ列y, color='cornflowerblue')
横棒グラフの色をクリムゾンにする	plt.barh(データ列x, データ列y, color='crimson')
日付時刻データが日付時刻データより後ろか調べる	aDatetime > aDatetime2
リストとリストの散布図を描いて、文字列という凡例用のラベルを付ける	plt.scatter(データ列x, データ列y, label=s)
線グラフの色を紺に指定する	plt.plot(データ列x, データ列y, color='darkblue')
option: マーカーの色を赤にする	markerfacecolor = 'red'
棒グラフをスカイブルー色で描画する	plt.bar(データ列x, データ列y, color='skyblue')
全ての句読点文字	string.punctuation
option: インディゴにグラフの色を設定する	color = 'indigo'
Pandasで、文字列を日付データに変換する	pd.to_datetime(s)
データ列の時刻	ds.dt.hour
option: マーカーの色をマゼンタにする	markerfacecolor = 'magenta'
書き込み用に文字列の示すエンコーディングとしてファイルをオープンする]	open(filepath, mode='w', encoding=s)
フローラルホワイト色を用いて折れ線グラフを描画する	plt.plot(データ列x, データ列y, color='floralwhite')
リストとリストについての散布図に赤い右三角マーカーを描画する	plt.plot(データ列x, データ列y, marker='>', c='r')
散布図の色をダークゴールデンロッドにする	plt.scatter(データ列x, データ列y, color='darkgoldenrod')
データフレームのリストカラムが正規分布からどれだけ、尖っているか見る	df[aList].skew()
ペールグリーン色で棒グラフを描画する	plt.bar(データ列x, データ列y, color='palegreen')
ヒストグラムをベージュ色を使って描画する	plt.hist(データ列, color='beige')
列をキーにして二つのデータフレームを結合する	pd.merge(df, df2, on=column)
ファイルからファイル名を見る	os.path.basename(filepath)
綺麗なグラフを描画する	import seaborn as sns
右三角印で散布図を描画する	plt.scatter(データ列x, データ列y, marker='>')
ヒストグラムを淡いピンク色色で描画する	plt.hist(データ列, color='lightpink')
シルバー色の横棒グラフを描画する	plt.barh(データ列x, データ列y, color='silver')
データフレームの最初を確認する	df.head()
日付時刻データと日付時刻データの時間差が何秒か知る	(aDatetime - aDatetime2).total_seconds()
文字列の開始位置と終了位置の間に部分文字列が含まれるか調べる	s.find(sub, start, end) != -1
nから無限に数え上げるする	itertools.count(start=n)
二つの文字列をケースを無視して比較する	s.casefold() < s2.casefold()
option: マーカーの色を紺碧にする	markerfacecolor = 'azure'
option: グラフの色をミディアムスプリンググリーンに設定する	color = 'mediumspringgreen'
2を底とする小数点数の対数	math.log2(x)
'A'列によってで降順にデータフレームをソートする	df.sort_values(by='A', ascending=False)
本日の月	datetime.datetime.today().month
文字列が無限に繰り返すイテラブル	itertools.repeat(element)
散布図の大バツ印の太さを変える	plt.scatter(データ列x, データ列y, marker='X', markeredgewidth=2.5)
横棒グラフの色をミディアムスレートブルーにする	plt.barh(データ列x, データ列y, color='mediumslateblue')
データ列の中にあるの合計を数える	ds.isin([value]).sum()
オプションで、標準出力を出力にする	file = sys.stdout
データ列を丸めて、整数型にする	ds.round().astype(int)
ヒストグラムをベージュ色で描画する	plt.hist(データ列, color='beige')
棒グラフの色をレモンシフォンにする	plt.bar(データ列x, データ列y, color='lemonchiffon')
データフレームのカラムが何曜日か見る	df[col].dt.weekday_name
データフレームを散布図で図示して、カテゴリごとに色を変える	sns.scatterplot(data=df, x='列名', y='列名', hue='カテゴリ列')
リストの値をクリアにする	aList.clear()
文字列TSVからn番目のカラムをインデックスとしてカンマ区切りのファイルを読み込む	pd.read_csv(filename, index_col=n)
散布図としてデータフレームの全カラムを見る	sns.pairplot(df)
組をn回、連結する	aTuple * n
ライトグレー色の線グラフを描画する	plt.plot(データ列x, データ列y, color='lightgray')
シエナにヒストグラムの色を変更する	plt.hist(データ列, color='sienna')
option: ダークグリーンにグラフの色を変更する	color = 'darkgreen'
データ列とリストについての散布図にrgbの星マーカーを描画する	plt.plot(データ列x, データ列y, marker='*', c=rgb)
列によってデータフレームをグループ分けして、各グループごとの標準偏差を求める	df.groupby(column).std()
ランダムにn行を表から抽出する	df.sample(n)
折れ線グラフをロイヤルブルー色として描画する	plt.plot(データ列x, データ列y, color='royalblue')
エクセルデータファイルからnとn2のシートを読み込む	pd.read_excel(filename, sheet_name=[n, n2])
Pandasで、データフレームのcollを日付データに変換する	pd.to_datetime(df[col])
青い実線でデータ列の推移をプロットする	plt.plot(データ列x, データ列y, linestyle='solid', color='b')
散布図の色をグレーにする	plt.scatter(データ列x, データ列y, color='grey')
散布図を右三角印で描画する	plt.scatter(データ列x, データ列y, marker='>')
