xを整数に変換する	int(x)
イテラブルを文字列リストに変換して、'改行で連結する	'\n'.join(map(str, iterable))
折れ線グラフの四角マーカーの大きさを変更する	plt.plot(データ列x, データ列y, marker='s', markersize=2.0)
カラーコードで折れ線グラフの色を設定する	plt.plot(データ列x, データ列y, color='#800080')
日付データからn秒を減算する	aDate - datetime.timedelta(seconds=n)
option: マーカーの色をスプリンググリーンにする	markerfacecolor = 'springgreen'
データフレームの欠損値を最小値に設定する	df.fillna(df.min())
ファイルパスから書き込みストリームを開いて]、fとする	f = open(filepath, mode='w')
折れ線グラフを用いてデータ列の推移を可視化する	plt.plot(range(len(データ列)), データ列)
棒グラフをグリーン色として描画する	plt.bar(データ列x, データ列y, color='green')
オブジェクトがリストクラスか調べる	isinstance(obj, list)
散布図の色をオレンジレッドにする	plt.scatter(データ列x, データ列y, color='orangered')
ライトゴールドロディイエロー色の線グラフを描画する	plt.plot(データ列x, データ列y, color='lightgoldenrodyellow')
折れ線グラフの色をオリーブに指定する	plt.plot(データ列x, データ列y, color='olive')
データフレームの欠損値を第二四分位数に設定する	df.fillna(df.median())
横棒グラフの色をオレンジにする	plt.barh(データ列x, データ列y, color='orange')
グラフの縦軸のラベルをuntitledに設定する	plt.ylabel('y軸ラベル')
ロージーブラウン色の横棒グラフを描画する	plt.barh(データ列x, データ列y, color='rosybrown')
実数とyのノルムを求める	math.hypot(x, y)
紺色で棒グラフを描画する	plt.bar(データ列x, データ列y, color='darkblue')
折れ線グラフをライトシアン色で描画する	plt.plot(データ列x, データ列y, color='lightcyan')
赤い破線でデータ列の推移を描画する	plt.plot(データ列x, データ列y, linestyle='dashed', color='r')
散布図をラベンダー色で描画する	plt.scatter(データ列x, データ列y, color='lavender')
ゴーストホワイト色の散布図を描画する	plt.scatter(データ列x, データ列y, color='ghostwhite')
貝殻色の棒グラフを描画する	plt.bar(データ列x, データ列y, color='seashell')
文字列をゼロ埋めする	s.zfill(文字列幅)
線グラフをライトスチールブルー色で描画する	plt.plot(データ列x, データ列y, color='lightsteelblue')
option: マーカーを丸に設定する	marker = 'o'
カーネル密度分布を描画する	sns.kdeplot(x='列名', hue='カテゴリ列', data=df)
option: ライトスカイブルーを使う	color = 'lightskyblue'
ヒストグラムをバリーウッド色で描画する	plt.hist(データ列, color='burlywood')
棒グラフをゲインズボロ色で描画する	plt.bar(データ列x, データ列y, color='gainsboro')
横棒グラフの色をデピンクにする	plt.barh(データ列x, データ列y, color='deeppink')
数列の推移を半透明の点線で描画する	plt.plot(データ列x, データ列y, linestyle='dotted', alpha=0.5)
option: ライトスレイグレー色を用いる	color = 'lightslategrey'
棒グラフをオレンジ色で描画する	plt.bar(データ列x, データ列y, color='orange')
オブジェクトは浮動小数点数型	isinstance(obj, float)
散布図をフォレストグリーン色で描画する	plt.scatter(データ列x, データ列y, color='forestgreen')
青い散布図を描画する	plt.scatter(データ列x, データ列y, color='b')
日付時刻データからn日分、減らす	aDatetime - datetime.timedelta(days=n)
シスル色の横棒グラフを描画する	plt.barh(データ列x, データ列y, color='thistle')
横棒グラフの色をシスルにする	plt.barh(データ列x, データ列y, color='thistle')
横棒グラフをカーキ色を使って描画する	plt.barh(データ列x, データ列y, color='khaki')
ダークスラテグレー色の散布図を描画する	plt.scatter(データ列x, データ列y, color='darkslategray')
青緑色でヒストグラムを描画する	plt.hist(データ列, color='teal')
散布図をブランチドアーモンド色として描画する	plt.scatter(データ列x, データ列y, color='blanchedalmond')
棒グラフの色をハニーデューにする	plt.bar(データ列x, データ列y, color='honeydew')
回帰モデルの精度を算出する	sklearn.metrics.mean_squared_error(目的変数, model.predict(説明変数))
ヒストグラムをブルーバイオレット色で描画する	plt.hist(データ列, color='blueviolet')
データフレームを列でソートし、、NaNを先頭にする	df.sort_values(by=column, na_position='first')
グラフに鉛直方向の実線を付ける	plt.axvline(x=0, linestyle='solid')
部分文字列を文字列の末尾から除く	s.removesuffix(sub)
折れ線グラフの色をピーチパフに設定する	plt.plot(データ列x, データ列y, color='peachpuff')
グラフの描画で色差別なくカラーパレットを使う	sns.set(pallete='colorblind')
データ列の欠損値を最小値に設定する	ds.fillna(ds.min())
タイムスタンプデータの月数	aDatetime.month
実数の複素数を算出する	complex(x)
バイナリ書き込みモードでファイルを開いて]fとする	f = open(filepath, mode='wb')
両端キューを空にする	deq.clear()
横棒グラフを青紫色を用いて描画する	plt.barh(データ列x, データ列y, color='violet')
nとn2の差	n - n2
option: マーカーの色をイエローグリーンにする	markerfacecolor = 'yellowgreen'
青緑色で棒グラフを描画する	plt.bar(データ列x, データ列y, color='teal')
ダークスレートブルー色の線グラフを描画する	plt.plot(データ列x, データ列y, color='darkslateblue')
行列を元に全要素が0の配列を作る	np.zeros_like(aArray)
option: フォントの色をダークグレーに指定する	color = 'darkgray'
日付時刻データが日曜日か確認する	aDatetime.weekday() == 6
データフレームとしてカンマ区切りのファイルを読み込む	pd.read_csv(filename, sep=',')
ダークグレー色のヒストグラムを描画する	plt.hist(データ列, color='darkgray')
白い散布図を描画する	plt.scatter(データ列x, データ列y, color='w')
文字列中に部分文字列がいくつか含まれるか調べる	s.count(sub)
データフレームのリストカラムの最頻値	df[aList].mode()
ミディアムオーキッド色の横棒グラフを描画する	plt.barh(データ列x, データ列y, color='mediumorchid')
ダークシアン色で折れ線グラフを描画する	plt.plot(データ列x, データ列y, color='darkcyan')
50パーセンタイルでデータフレームのリスト列の欠損値を埋める	df[aList].fillna(df[aList].median())
折れ線グラフをシーグリーン色で描画する	plt.plot(データ列x, データ列y, color='seagreen')
プラットホームがWindowsか調べる	sys.platform.startswith('win32')
散布図をデピンク色で描画する	plt.scatter(データ列x, データ列y, color='deeppink')
ダークマゼンタ色の線グラフを描画する	plt.plot(データ列x, データ列y, color='darkmagenta')
データフレームを'A'列の値でグループ化する	df.groupby('A')
辞書の値の一覧を得る	aDict.values()
ミディアムパープル色の横棒グラフを描画する	plt.barh(データ列x, データ列y, color='mediumpurple')
事前に複数行対応として正規表現をコンパイルする	re.compile(pattern, flag=re.MULTILINE)
ヒストグラムをグレー色を用いて描画する	plt.hist(データ列, color='gray')
列の欠損値を前の行の値に設定する	ds.fillna(method='ffill')
ヒストグラムをスラグレー色で描画する	plt.hist(データ列, color='slategray')
ヒストグラムの色を茶色に指定する	plt.hist(データ列, color='brown')
折れ線グラフの色をダークバイオレットに設定する	plt.plot(データ列x, データ列y, color='darkviolet')
棒グラフの色を黄色にする	plt.bar(データ列x, データ列y, color='yellow')
option: 青緑を使う	color = 'teal'
双方向キューの先頭に要素を追加する	deq.appendleft(element)
option: バリーウッドにグラフの色を設定する	color = 'burlywood'
カラーバーを付ける	plt.colorbar()
option: 線の種類を破線にセットする	linestyle = 'dashed'
縦に三つのデータフレームを連結する	pd.concat([df, df2, df3], axis=0)
データフレームの重複していない行のみを抽出する	df[not df.duplicated(keep=False)]
折れ線グラフをオリーブ色で描画する	plt.plot(データ列x, データ列y, color='olive')
整数nを二進文字列に変換する	bin(n)[2:]
データフレームの列が正規表現文字列にマッチする行を抽出する	df[df[column].str.match(s)]
スラグレー色として棒グラフを描画する	plt.bar(データ列x, データ列y, color='slategrey')
option: サドルブラウンにグラフの色を指定する	color = 'saddlebrown'
データフレームのカラムを十の位で四捨五入して、整数型にする	df[col].round(-1).astype(int)
横棒グラフをダークサーモン色で描画する	plt.barh(データ列x, データ列y, color='darksalmon')
データフレームのカラムのタイムゾーンを日本にセットする	df[col].tz_convert('Asia/Tokyo')
イテラブルから配列を作る	np.array(iterable)
折れ線グラフの▲マーカーの色を指定する	plt.plot(データ列x, データ列y, marker='^', markerfacecolor='#800080')
文字列をASCII限定として正規表現で区切る	re.split(pattern, s, flags=re.ASCI)
文字列を隔離する	sys.intern(s)
紺色で散布図を描画する	plt.scatter(データ列x, データ列y, color='darkblue')
option: マーカーの色を青紫にする	markerfacecolor = 'violet'
折れ線グラフのラベルを変更する	plt.plot(データ列x, データ列y, label='ラベル')
棒グラフの色をダークバイオレットにする	plt.bar(データ列x, データ列y, color='darkviolet')
日付時刻データからn時間分、減算する	aDatetime - datetime.timedelta(hours=n)
option: ダークマゼンタ色を使う	color = 'darkmagenta'
ヒストグラムの線の種類を実線に設定する	plt.hist(データ列, linestyle='solid')
ネイビー色の横棒グラフを描画する	plt.barh(データ列x, データ列y, color='navy')
データ列のどの値が頻出か見る	ds.mode()
イテラブルを箱ひげ図にする	plt.boxplot(データ列)
散布図のマーカーの大きさを指定する	plt.scatter(データ列x, データ列y, markersize=2.0)
縦棒グラフをプロットして、左寄せする	plt.bar(ラベル列, データ列, align='edge')
値を太字でプリントできる文字列に変換する	f'\033[1m{value}\033[0m'
y軸だけ目盛線	plt.grid(axis='y')
データフレームからカテゴリデータの列名の一覧を使う	df.select_dtypes('object').columns
列から1個ランダムに選ぶ	random.choice(iterable)
データ列を10の位で丸めて、整数にする	ds.round(-1).astype(int)
ロージーブラウン色の散布図を描画する	plt.scatter(データ列x, データ列y, color='rosybrown')
横棒グラフの色をライトコーラルにする	plt.barh(データ列x, データ列y, color='lightcoral')
散布図をディムグレー色で描画する	plt.scatter(データ列x, データ列y, color='dimgray')
ロージーブラウン色の線グラフを描画する	plt.plot(データ列x, データ列y, color='rosybrown')
ヒストグラムの色をシーグリーンに設定する	plt.hist(データ列, color='seagreen')
ターコイズにヒストグラムの色を設定する	plt.hist(データ列, color='turquoise')
横棒グラフをスラグレー色を用いて描画する	plt.barh(データ列x, データ列y, color='slategray')
左三角マーカーで散布図を描画する	plt.plot(データ列x, データ列y, marker='<')
リストの末尾を取り除く	aList[:-1]
線グラフの色をスチールブルーに設定する	plt.plot(データ列x, データ列y, color='steelblue')
ファイル全体を行単位で分割して読み込む	f.readlines()
文字列の開始位置から終了位置の範囲で部分文字列の出現	s.count(sub, start, end)
option: ミディアムターコイズ色を使う	color = 'mediumturquoise'
四角マーカーで散布図を描画する	plt.plot(データ列x, データ列y, marker='s')
nが無限に続くイテラブル	itertools.repeat(n)
棒グラフの色をミディアムターコイズにする	plt.bar(データ列x, データ列y, color='mediumturquoise')
ヒストグラムの色をホワイトに設定する	plt.hist(データ列, color='white')
日付時刻データの日数を求める	aDatetime.day
何回まで再帰ができるか、調べる	sys.getrecursionlimit()
散布図をダークカーキ色として描画する	plt.scatter(データ列x, データ列y, color='darkkhaki')
左三角マーカーを用いてデータ列の折れ線グラフを描画する	plt.plot(データ列x, データ列y, marker='<')
マッピングの浅いコピーを作る	aDict.copy()
黒い▽印を散布図に描画する	plt.scatter(データ列x, データ列y, marker='v', markerfacecolor='k')
データフレームを二つの列の値によってグループ化して、列挙する	[(name, group) for name, group in df.groupby(['A', 'B'])]
option: マーカーを星に設定する	marker = '*'
散布図をダークターコイズ色で描画する	plt.scatter(データ列x, データ列y, color='darkturquoise')
二つの文字列をコロンで区切ってプリントする	print(value, value2, sep=':')
日付データと日付データの時間差を秒で求める	(aDate - aDate2).total_seconds()
線グラフをゲインズボロ色で描画する	plt.plot(データ列x, データ列y, color='gainsboro')
スピアマン順位相関係数でデータフレームのリスト列の相関行列	df[aList].corr(method='spearman')
オブジェクトは整数クラス	isinstance(obj, int)
辞書にキーワード引数として更新する	aDict.update(**kwargs)
十六進文字列をバイト列に変換する	int(s, 16).to_bytes(length=bytesize, byteorder='big')
三自然数のLCM	math.lcm(n, n2, n3)
バリーウッド色としてヒストグラムを描画する	plt.hist(データ列, color='burlywood')
日付時刻データと日付時刻データの時間差は何秒か知る	(aDatetime - aDatetime2).total_seconds()
option: データ型として複素数型を使う	dtype = bool
カウンタをイテラブルとして更新する	aCounter.update(iterable)
散布図の丸マーカーを黒くする	plt.scatter(データ列x, データ列y, marker='o', markerfacecolor='k')
実数を実数に加算する	x + y
線グラフの色を耐火レンガに設定する	plt.plot(データ列x, データ列y, color='firebrick')
option: グラフの色をオリベドラブに設定する	color = 'olivedrab'
ホットピンク色の線グラフを描画する	plt.plot(データ列x, データ列y, color='hotpink')
データフレームの未入力値を平均値に設定する	df.fillna(df.mean())
データフレームを複数の列によってソートして、更新する	df.sort_values(by=column, inplace=True)
ヒストグラムをゴーストホワイト色で描画する	plt.hist(データ列, color='ghostwhite')
多次元データをt-SNEとしてパステル調に次元に次元削減する	sklearn.manifold.TSNE(n_components=N).fit_transform(多次元データ)
散布図に丸マーカーを用いる	plt.plot(データ列x, データ列y, marker='o')
ディムグレー色で折れ線グラフを描画する	plt.plot(データ列x, データ列y, color='dimgrey')
ネイビー色のヒストグラムを描画する	plt.hist(データ列, color='navy')
ヒストグラムの色をライトグレーに変更する	plt.hist(データ列, color='lightgray')
データフレームのリストカラムの文字列をNaNに変換する	df[aList].replace(s, np.nan)
データフレームを表示するとき、表示可能な最大列数を変更する	pd.set_option('display.max_columns', n)
散布図をブラック色で描画する	plt.scatter(データ列x, データ列y, color='black')
データフレームの文字列を欠損値にする	df.replace(s, np.nan)
Pandasで、数値時刻のデータフレームのcollからdatetime64型にする	pd.to_datetime(df[col], unit='s', utc=True)
ファイルから追加ストリームをオープンして]、fとする	f = open(filepath, mode='a')
最大長nの双方向キューを生成する	collections.deque(maxlen=n)
データフレームのカラムの欠損値を後の行の値に指定する	df[col].fillna(method='bfill')
option: ライトコーラル色を使う	color = 'lightcoral'
三角マーカーを散布図に使う	plt.plot(データ列x, データ列y, marker='^')
ヒストグラムを黄色色で描画する	plt.hist(データ列, color='yellow')
option: ダークレッド色を用いる	color = 'darkred'
ピーチパフ色でヒストグラムを描画する	plt.hist(データ列, color='peachpuff')
散布図の色をダークグリーンにする	plt.scatter(データ列x, データ列y, color='darkgreen')
小数点数のsinの逆数	math.asin(x)
リストとリストについての散布図に黒い三角マーカーを描画する	plt.plot(データ列x, データ列y, marker='^', c='k')
データ列のタイムゾーンを日本に設定する	ds.tz_convert('Asia/Tokyo')
ゴールデンロッド色を用いて棒グラフを描画する	plt.bar(データ列x, データ列y, color='goldenrod')
ミディアムオーキッド色の線グラフを描画する	plt.plot(データ列x, データ列y, color='mediumorchid')
標準出力のバッファを強制表示する	sys.stdout.flush()
ファイルを改行を取り除いて一行ずつ読み込む	f.readline()
ヒストグラムの色をオレンジレッドに設定する	plt.hist(データ列, color='orangered')
タプルの各要素を関数に適用した結果でソートする	sorted(aTuple, key=func)
部分文字列を文字列の先頭から探す	s.find(sub)
Pandasで文字列のエポック秒から日付データにする	pd.to_datetime(s, unit='s', utc=True)
円グラフの特定の要素を目立たせる	plt.pie(データ列, startangle=90, explode=[0, 0.3, 0])
カテゴリに並べてデータフレームを箱ひげ図にする	sns.boxplot(x='カテゴリ列', y='列', data=df)
nがn2の倍数でないか	n % n2 != 0
ヒストグラムをラベンダー色で描画する	plt.hist(データ列, color='lavender')
実数が無限大か調べる	math.isinf(x)
データ列の出現頻度を作図する	plt.hist(データ列)
イテラブルから双方向キューを用意する	collections.deque(iterable)
パーセプトロンでクラス分類を行う	model = sklearn.neural_network.MLPClassifier(hidden_layer_sizes=(10, 10))
文字列の中の正規表現による全てのマッチを使う	re.findall(pattern, s)
文字列の開始位置以降に部分文字列が含まれないかどうか調べる	s.find(sub, start) == -1
棒グラフをライトスレイグレー色で描画する	plt.bar(データ列x, データ列y, color='lightslategrey')
整数乱数で要素を埋めた配列	np.random.randint(開始値, 終了値, N)
散布図の色をカーキにする	plt.scatter(データ列x, データ列y, color='khaki')
文字列が全て英数字	s.isalnum()
option: グラフの色をダークマゼンタに設定する	color = 'darkmagenta'
横棒グラフをミディアムターコイズ色で描画する	plt.barh(データ列x, データ列y, color='mediumturquoise')
データフレームをグループ化し、各列に対し個数を求める	df.groupby(column)[column2].count()
文字列リストをひとつの文字列にする	''.join(map(str, iterable))
option: グラフの色をディムグレーに指定する	color = 'dimgray'
降順でデータフレーム全体をインデックスによってソートする	df.sort_index(ascending=False)
ふたつの集合のいずれか一方だけの集合	aSet.symmetric_difference(aSet2)
数値を緑色でプリントする	print(f'\033[32m{value}\033[0m')
折れ線グラフの三角マーカーの大きさを変更する	plt.plot(データ列x, データ列y, marker='^', markersize=2.0)
データフレームを列の値で集約し、、最大値を求める	df.groupby(column).max()
平均で列の欠損値を埋める	ds.fillna(ds.mean())
散布図のクロスマーカーの大きさを変更する	plt.scatter(データ列x, データ列y, marker='x', markersize=2.0)
option: グラフの色をパールバイオレットレッドに指定する	color = 'palevioletred'
データ列の分	ds.dt.minute
option: 色を紺に設定する	color = 'darkblue'
ダークスラテグレー色で横棒グラフを描画する	plt.barh(データ列x, データ列y, color='darkslategray')
ゲインズボロ色で折れ線グラフを描画する	plt.plot(データ列x, データ列y, color='gainsboro')
nが負の数かどうか調べる	n < 0
データフレームが正規分布からどの程度、尖っているか見る	df.skew()
ラベンダー色の線グラフを描画する	plt.plot(データ列x, データ列y, color='lavender')
データフレームのリストカラムが正規分布からどの程度尖っているか確認する	df[aList].skew()
散布図の左三角マーカーの大きさを変更する	plt.scatter(データ列x, データ列y, marker='<', markersize=2.0)
ヒストグラムの色をパープルに変更する	plt.hist(データ列, color='purple')
データフレームの行を抽出する	df[start:end]
TSVを読む	pd.read_csv(filename, sep='\t', encoding='utf-8')
青緑色で横棒グラフを描画する	plt.barh(データ列x, データ列y, color='turquoise')
プラム色の横棒グラフを描画する	plt.barh(データ列x, データ列y, color='plum')
折れ線グラフの三角印の大きさを変える	plt.plot(データ列x, データ列y, marker='^', markersize=2.0)
散布図の色をラベンダーにする	plt.scatter(データ列x, データ列y, color='lavender')
横棒グラフを暗い赤色で描画する	plt.barh(データ列x, データ列y, color='darkred')
組の文字列が最初に見つかるインデックスを使う	aTuple.index(element)
昇順に列によってデータフレームをソートして更新する	df.sort_values(by=column, ascending=True, inplace=True)
真部分集合か調べる	aSet < aSet2
リストとイテラブルについて散布図を描画して、マーカーを丸に変更する	plt.plot(データ列x, データ列y, marker='o')
nとn2の値を足してnとする	n += n2
ふたつの集合が共通の要素を持たないか	aSet.isdisjoint(aSet2)
双方向キューの先頭に列の各要素を入れる	deq.extendleft(iterable)
year年month月day日を日付に変換する	datetime.date(year=year, month=month, day=day)
文字列内にひとつでも英数字が含まれるか調べる	any(c.isalnum() for c in s)
year年day月の日付時刻	datetime.datetime(year=year, month=month, day=1)
データフレームのカラムを散布図でプロット化して、カテゴリ別にマーカーを変える	sns.scatterplot(data=df, x='列名', y='列名', style='カテゴリ列')
ミディアムオーキッドにヒストグラムの色を設定する	plt.hist(データ列, color='mediumorchid')
データフレームの中に文字列と日付データがある	df.isin([value, value2])
折れ線グラフをマゼンタ色を用いて描画する	plt.plot(データ列x, データ列y, color='magenta')
棒グラフを耐火レンガ色を使って描画する	plt.bar(データ列x, データ列y, color='firebrick')
折れ線グラフの色をライトグレーに設定する	plt.plot(データ列x, データ列y, color='lightgrey')
キーで指定された項目を辞書から取り出す	aDict.pop(key)
文字列を最初の部分文字列で分けた時の前半の文字列を求める	s.partition(sub)[0]
option: グラフの色をライトイエローに設定する	color = 'lightyellow'
プラットホームがMacOSか調べる	sys.platform.startswith('darwin')
横棒グラフをレベッカパープル色で描画する	plt.barh(データ列x, データ列y, color='rebeccapurple')
横棒グラフの色をチョコレートにする	plt.barh(データ列x, データ列y, color='chocolate')
散布図の上三角マーカーを赤くする	plt.scatter(データ列x, データ列y, marker='^', markerfacecolor='r')
散布図の色を青にする	plt.scatter(データ列x, データ列y, color='blue')
線グラフをロージーブラウン色を使って描画する	plt.plot(データ列x, データ列y, color='rosybrown')
実数を数に掛ける	x * y
散布図のマーカーを大バツにする	plt.scatter(データ列x, データ列y, marker='X')
データフレームのNaNを平均に設定する	df.fillna(df.mean())
