xを整数に変換する	int(x)
データフレームから指定された二つの列を抽出する	df[[column, column2]]
折れ線グラフの色をブラックに設定する	plt.plot(データ列x, データ列y, color='black')
データをL2ノルムとして正規化する	"sklearn.preprocessing.Normalizer(norm=""l2"").fit_transform(データ列)"
クラス分類の適合率を求める	sklearn.metrics.precision_score(正解データ列, 予測データ列)
データフレームの行を条件でフィルタするには	df[(df[column] == x) & (df[column2] == x2)]
option: 降順にする	ascending = False
プログラムの実行を異常止める	sys.exit(1)
折れ線グラフに大バツマーカーを使う	plt.plot(データ列x, データ列y, marker='X')
データフレームを各列と列の組み合わせ毎にグループ化して、標準偏差を求める	df.groupby([column, column2], as_index=False).std()
rgbに横棒グラフの色を設定する	plt.barh(ラベル列, データ列, color=rgb)
行列の行ごとの最小	np.min(aArray, axis=1)
ファイルからバイナリストリームをオープンして]、fとする	f = open(filepath, mode='rb')
データフレームのリストカラムの母標準偏差を算出する	df[aList].std(ddof=0)
nをn2だけ減少させる	n -= n2
ミントクリーム色でヒストグラムを描画する	plt.hist(データ列, color='mintcream')
データ列とリストの散布図に赤い丸マーカーを描く	plt.plot(データ列x, データ列y, marker='o', c='r')
データフレームの全カラムを散布図で可視化する	sns.pairplot(df)
棒グラフの色をミッドナイトブルーにする	plt.bar(データ列x, データ列y, color='midnightblue')
実数を百の位で丸める	round(x, -2)
辞書に項目名がない場合、要素を追加する	aDict.setdefault(key, element)
散布図の色をシアンにする	plt.scatter(データ列x, データ列y, color='cyan')
option: 印をバツに変更する	marker = 'x'
データフレームのリスト列を千の位で丸める	df[aList].round(-3)
ValueMapでまとめてデータ列の値を置き換える	ds.replace(ValueMap)
日付データをn週間前に戻す	aDate - datetime.timedelta(weeks=n)
イテラブルの長さnの順列	itertools.permutations(iterable, n)
辞書をJSON形式で出力ストリームに保存する	json.dump(aDict, fout, ensure_ascii=False)
文字列が漢字か調べる	('\u4E00' <= ch <= '\u9FD0')
データフレームの列の名前一覧で指定した列をドロップする	df.drop(columns, axis=1)
リストとリストについての散布図に黒い星マーカーを描画する	plt.plot(データ列x, データ列y, marker='*', c='k')
option: マーカーの色をペルーにする	markerfacecolor = 'peru'
折れ線グラフの四角印の色を変える	plt.plot(データ列x, データ列y, marker='s', markerfacecolor='#800080')
双方向キューが空でないかどうか調べる	len(deq) != 0
線グラフの色をイエローグリーンに設定する	plt.plot(データ列x, データ列y, color='yellowgreen')
データフレームをグループ化してヒストグラムでプロット化する	sns.histplot(df, x='列名', hue='カテゴリ名')
黒い星マーカーで散布図を描画する	plt.plot(データ列x, データ列y, marker='*', c='k')
計算機イプシロン	sys.float_info.epsilon
第二四分位数でデータフレームの欠損値を補う	df.fillna(df.median())
整数nを十六進表現に変換する	hex(n)
ミディアムバイオレットレッド色の棒グラフを描画する	plt.bar(データ列x, データ列y, color='mediumvioletred')
セットが空でない	len(aSet) != 0
折れ線グラフの下三角マーカーの色を変更する	plt.plot(データ列x, データ列y, marker='v', markerfacecolor='#800080')
文字列の左側から空白を取り除く	s.lstrip(' ')
ヒストグラムをダークスレートブルー色で描画する	plt.hist(データ列, color='darkslateblue')
折れ線グラフのマーカーをバツにする	plt.plot(データ列x, データ列y, marker='x')
辞書の項目名と値を入れ替える	{v: k for k, v in aDict.items()}
リストとリストについて散布図を描画し、マーカーを三角に設定する	plt.plot(データ列x, データ列y, marker='^')
ダークスレートブルー色で棒グラフを描画する	plt.bar(データ列x, データ列y, color='darkslateblue')
真紅にヒストグラムの色を設定する	plt.hist(データ列, color='crimson')
散布図をタン色で描画する	plt.scatter(データ列x, データ列y, color='tan')
option: グラフの色をゴールデンロッドに指定する	color = 'goldenrod'
縦棒グラフをチョコレート色で描画する	plt.bar(データ列x, データ列y, color='chocolate')
ガウス過程を使ってクラス分類をする	model = sklearn.gaussian_process.GaussianProcessClassifier()
ミディアムターコイズ色として縦棒グラフを描画する	plt.bar(データ列x, データ列y, color='mediumturquoise')
紺碧色の棒グラフを描画する	plt.bar(データ列x, データ列y, color='azure')
数列とリストについての散布図を大きさnで描画する	plt.scatter(データ列x, データ列y, s=n)
線グラフを色付きの破線でプロットする	plt.plot(データ列x, データ列y, linestyle='dashed', color='#800080')
データフレームから指定された2つの列を抽出する	df[[column, column2]]
インデント幅nで、辞書をJSON形式の文字列にする	json.dumps(aDict, ensure_ascii=False, indent=n)
データフレームを列を用いて並べ、、新しいインデックスを加える	df.sort_values(columns).reset_index()
折れ線グラフをアクア色で描画する	plt.plot(データ列x, データ列y, color='aqua')
ヒストグラムをパールゴールデンロッド色として描画する	plt.hist(データ列, color='palegoldenrod')
ファイルをバイナリ書き込みできるように開く]	open(filepath, mode='wb')
ピアソン積率相関係数として表のリスト列の相関行列	df[aList].corr(method='pearson')
データを最大値と最小値で正規化する	sklearn.preprocessing.MinMaxScaler(feature_range=(0, 1)).fit_transform(データ)
nからstep間隔で無限に数え上げるする	itertools.count(start=n, step=step)
横軸の目盛を対数に変更する	plt.xscale('log')
データフレームを各列と列の組み合わせ毎にグループ化し、、最小値を求める	df.groupby([column, column2], as_index=False).min()
文字列は全て十進数字か調べる	s.isdecimal()
ダークゴールデンロッド色の線グラフを描画する	plt.plot(データ列x, データ列y, color='darkgoldenrod')
データフレームの値は欠損値	df.isna()
データフレームのグループごとの標準偏差	df.groupby(column).std()
サポートベクターマシンを使ってクラス分類を行う	model = sklearn.svm.SVR(kernel='rbf', C=1e3, gamma=0.1, epsilon=0.1)
option: グラフの色をミディアムパープルに設定する	color = 'mediumpurple'
16進文字列をバイト列にする	int(s, 16).to_bytes(length=bytesize, byteorder='big')
小文字列	string.ascii_lowercase
標準入力から1行分読み込んで、改行を取り除く	sys.stdin.readline().rstrip()
データフレームを1000の位で丸めて、整数型にする	df.round(-3).astype(int)
グラフのデータラベルを表示する	plt.legend()
スカイブルー色の横棒グラフを描画する	plt.barh(データ列x, データ列y, color='skyblue')
rgbの右三角マーカーを散布図に使う	plt.plot(データ列x, データ列y, marker='>', c=rgb)
y座標の目盛を表示しない	plt.yticks([])
ゼロ埋めされた三２ビット整数型の配列を作成する	np.zeros(要素数, dtype=np.int16)
オーキッドにヒストグラムの色をセットする	plt.hist(データ列, color='orchid')
ターコイズ色で折れ線グラフを描画する	plt.plot(データ列x, データ列y, color='turquoise')
既存のファイルパスをBOM付きで追加できるようにオープンする]	open(filepath, mode='a', encoding='utf_8_sig')
棒グラフの色をターコイズにする	plt.bar(データ列x, データ列y, color='turquoise')
折れ線グラフの星マーカーを青くする	plt.plot(データ列x, データ列y, marker='*', markerfacecolor='b')
改行せず２つの文字列を表示する	print(value, value2, end='')
スピアマン順位相関係数としてデータフレームのカラムと列の相関行列	df[[column, column2]].corr(method='spearman')
横棒グラフを紺碧色で描画する	plt.barh(データ列x, データ列y, color='azure')
option: シャルトリューズにグラフの色を変更する	color = 'chartreuse'
データを最大値と最小値で正規化する	sklearn.preprocessing.MinMaxScaler().fit_transform(データ)
異なるn個のものからk個選ぶ場合の数	math.comb(n, k)
グラフの見た目をデフォルトでいい感じにセットする	sns.set()
文字列が全て英字か調べる	s.isalpha()
ライトグリーン色として横棒グラフを描画する	plt.barh(データ列x, データ列y, color='lightseagreen')
散布図をデピンク色を使って描画する	plt.scatter(データ列x, データ列y, color='deeppink')
散布図をゴールド色で描画する	plt.scatter(データ列x, データ列y, color='gold')
折れ線グラフをダークゴールデンロッド色で描画する	plt.plot(データ列x, データ列y, color='darkgoldenrod')
ピーチパフ色の散布図を描画する	plt.scatter(データ列x, データ列y, color='peachpuff')
ローングリーン色の散布図を描画する	plt.scatter(データ列x, データ列y, color='lawngreen')
文字列リストを結合する	''.join(aStringList)
昇順にデータフレームを'A'列によって並べる	df.sort_values(by='A', ascending=True)
ヒストグラムをホワイト色で描画する	plt.hist(データ列, color='white')
スタックをポップする	deq.pop()
option: ダークシアグリーン色を用いる	color = 'darkseagreen'
折れ線グラフを青い実線として描画する	plt.plot(データ列x, データ列y, linestyle='solid', color='b')
散布図の色をラベンダーブラッシュにする	plt.scatter(データ列x, データ列y, color='lavenderblush')
日付データからn秒分減算する	aDate - datetime.timedelta(seconds=n)
散布図をミディアムバイオレットレッド色で描画する	plt.scatter(データ列x, データ列y, color='mediumvioletred')
プロットをポスター用に設定する	sns.set(context='poster')
データフレームのカラムのモード	df[col].mode()
二つの変数をそれぞれ定義する	x, y = i, j
ファイル名がJSONファイル	filename.endswith('.json')
プラム色で棒グラフを描画する	plt.bar(データ列x, データ列y, color='plum')
エクセルデータファイルからnという名前のシートをデータフレームとして読む	pd.read_excel(filename, sheet_name=n)
ヒストグラムの色をタンに指定する	plt.hist(データ列, color='tan')
ファイルをSJISで書き込み用にオープンする]	open(filepath, mode='w', encoding='shift_jis')
option: 線の種類を点線に設定する	linestyle = 'dotted'
青いバツ印を散布図に描画する	plt.scatter(データ列x, データ列y, marker='x', markerfacecolor='b')
文字列の先頭だけ大文字化する	s.capitalize()
オブジェクトに属性があるか調べる	hasattr(obj, プロパティ名)
パールゴールデンロッドにヒストグラムの色を設定する	plt.hist(データ列, color='palegoldenrod')
本日が月曜日か調べる	datetime.datetime.today().weekday() == 0
データ列をインポートする	import pandas as pd
棒グラフの色をダークスラテグレーにする	plt.bar(データ列x, データ列y, color='darkslategray')
ディムグレー色で横棒グラフを描画する	plt.barh(データ列x, データ列y, color='dimgrey')
option: グラフの色をライトサーモンに設定する	color = 'lightsalmon'
データフレームのリストカラムがどれだけ、分散しているか確認する	df[aList].var()
星印で散布図を描画する	plt.scatter(データ列x, データ列y, marker='*')
横棒グラフをターコイズ色で描画する	plt.barh(データ列x, データ列y, color='turquoise')
カーキにヒストグラムの色を設定する	plt.hist(データ列, color='khaki')
散布図をフクシア色で描画する	plt.scatter(データ列x, データ列y, color='fuchsia')
折れ線グラフをダークシアン色で描画する	plt.plot(データ列x, データ列y, color='darkcyan')
二つの列でによって降順にデータフレームをソートする	df.sort_values(by=['A', 'B'], ascending=False)
棒グラフの色をライトスレイグレーにする	plt.bar(データ列x, データ列y, color='lightslategray')
option: フォントの色をペールグリーンに設定する	color = 'palegreen'
赤いクロスマーカーを散布図に使う	plt.plot(データ列x, データ列y, marker='x', c='r')
新しい文字列に文字列中の部分文字列を置き換える	s.replace(sub, newsub)
データ列が何分か確認する	ds.dt.minute
データフレームの中の列をn個に等量でビン分割する	pd.qcut(df[col], n)
文字列の中の大文字・小文字を無視して正規表現による全てのマッチを使う	re.findall(pattern, s, flags=re.IGNORECASE)
列によってデータフレームをグループ化して、それぞれのグループごとの標準偏差を求める	df.groupby(column).std()
year年の日付	datetime.date(year=year, month=1, day=1)
散布図を赤い四角マーカーで描く	plt.plot(データ列x, データ列y, marker='s', c='r')
nが無限に続くリストを得る	itertools.repeat(n)
横棒グラフの色をモカシンにする	plt.barh(データ列x, データ列y, color='moccasin')
ヒストグラムをロイヤルブルー色で描画する	plt.hist(データ列, color='royalblue')
折れ線グラフの色をカデットブルーに変更する	plt.plot(データ列x, データ列y, color='cadetblue')
散布図の右三角マーカーを黒色にする	plt.scatter(データ列x, データ列y, marker='>', markerfacecolor='k')
散布図に三角マーカーを使う	plt.plot(データ列x, データ列y, marker='^')
スレートブルー色でヒストグラムを描画する	plt.hist(データ列, color='slateblue')
データフレームを散布図で可視化して、カテゴリ別に色を変える	sns.scatterplot(data=df, x='列名', y='列名', hue='カテゴリ列')
ヒストグラムの色をコーラルに設定する	plt.hist(データ列, color='coral')
formatパターンの文字列を日付時刻に変換する	datetime.datetime.strptime(日付の書かれた文字列, format)
データフレームのリストカラムの欠損値を最頻値で補う	df[aList].fillna(df[aList].mode().iloc[0])
散布図の色をライトサーモンにする	plt.scatter(データ列x, データ列y, color='lightsalmon')
nのバイト長	(n.bit_length() + 7) // 8
option: ピーチパフ色を使う	color = 'peachpuff'
赤い四角マーカーとして散布図を描画する	plt.plot(データ列x, データ列y, marker='s', c='r')
データフレームのカラムの秒	df[col].dt.second
グラフを用いる	import matplotlib.pyplot as plt
option: 色をフクシアに設定する	color = 'fuchsia'
行列の和	aArray + aArray2
スタッキングで回帰分析を行う	sklearn.ensemble.StackingRegressor()
アリスブルー色の散布図を描画する	plt.scatter(データ列x, データ列y, color='aliceblue')
黄色い折れ線グラフを描画する	plt.plot(データ列x, データ列y, color='y')
ライトサーモン色の棒グラフを描画する	plt.bar(データ列x, データ列y, color='lightsalmon')
アンサンブル学習で回帰分析を行う	sklearn.ensemble.VotingRegressor()
option: フォントの色をインディゴに設定する	color = 'indigo'
フィッシャーの線形判別分類を行う	model = sklearn.manifold.TSNE(n_components=n)
データフレームの中のカラムを等量でビン数nでビン分割する	pd.qcut(df[col], n)
文字列中の部分文字列を新しい文字列に回数を制限して置換する	s.replace(sub, newsub, n)
データフレームを各列毎にグループ化して、文字列というグループの個数を求める	df.groupby(column).size()[s]
縦棒グラフをダークオレンジ色で描画する	plt.bar(データ列x, データ列y, color='darkorange')
線グラフをサンディーブラウン色で描画する	plt.plot(データ列x, データ列y, color='sandybrown')
ファイルパスをオープンして]、バイナリ書き込みストリームを使う	open(filepath, mode='wb')
データフレームのカラムをグループ化して、ヒストグラムで見る	sns.histplot(df, x='列名', hue='カテゴリ名')
散布図の色をレベッカパープルにする	plt.scatter(データ列x, データ列y, color='rebeccapurple')
ひとつでもアルファベットが文字列内に含まれる	any(c.isalpha() for c in s)
文字列は組に含まれるか調べる	element in aTuple
辞書のキーを要素に変更する	aDict[key] = element
データフレームの中の列と列に重複があれば、削除する	df.drop_duplicates(subset=[column, column2])
ファイルのファイルサイズ	os.path.get_size(filepath)
データフレームの列をインプレイスで削除する	df.drop(column, axis=1, inplace=True)
折れ線グラフの色をアクアに設定する	plt.plot(データ列x, データ列y, color='aqua')
option: フォントの色を貝殻に設定する	color = 'seashell'
折れ線グラフの色をミディアムスレートブルーに変更する	plt.plot(データ列x, データ列y, color='mediumslateblue')
日付時刻データにn分分、加算する	aDatetime + datetime.timedelta(minutes=n)
グラフに水平方向の一点鎖線を付ける	plt.axhline(y=0, linestyle='dashbot')
コロンで文字列を区切って、列挙する	s.split(':')
浮動小数点数の最小値	sys.float_info.min
線グラフの色をライトサーモンに設定する	plt.plot(データ列x, データ列y, color='lightsalmon')
グラフの凡例の位置を指定する	plt.legend(loc=(x, y))
縦棒グラフをプロットしてバーの幅を調整する	plt.bar(ラベル列, データ列, width=0.5)
タプルを逆順にする	aTuple[::-1]
多次元データをt-SNEでパステル調に次元に次元削減する	sklearn.manifold.TSNE(n_components=N).fit_transform(多次元データ)
既存のファイルをSJISとして追加できるようにオープンする]	open(filepath, mode='a', encoding='shift_jis')
折れ線グラフのマーカーを大バツにする	plt.plot(データ列x, データ列y, marker='X')
グリッド線	plt.grid(linewidth=3.0)
二つの文字列は等しくないか調べる	s != s2
ひとつでも非小文字が文字列中にあるか	any(not c.islower() for c in s)
オレンジレッド色を使って棒グラフを描画する	plt.bar(データ列x, データ列y, color='orangered')
配列の全要素を指定の値にする	aArray[:, :] = 指定の値
中央値でデータフレームのリストカラムのNaNを埋める	df[aList].fillna(df[aList].median())
option: マーカーの色をオリーブにする	markerfacecolor = 'olive'
データフレームを複数の列で昇順に破壊的にソートする	df.sort_values(by=column, ascending=True, inplace=True)
データフレームの列のNaNを最大値で埋める	df[col].fillna(df[col].max())
散布図に黒いマーカーを描画する	plt.scatter(データ列x, データ列y, markerfacecolor='k')
折れ線グラフの色をサンディーブラウンに設定する	plt.plot(データ列x, データ列y, color='sandybrown')
データフレームの列の値がxより少ないデータを抽出する	df[df[column] < x]
多次元データを多次元尺度構成法を用いて濃く次元に次元削減する	sklearn.manifold.MSD(n_components=二).fit_transform(多次元データ)
option: マーカーの色をフローラルホワイトにする	markerfacecolor = 'floralwhite'
Pandasで、日付データのデータ列をデータフレームのインデックスにする	df.index = pd.DatetimeIndex(ds)
データフレームの内で、列と列の重複を見る	df.duplicated(subset=[column, column2])
データフレームの指定した４つの列だけ選ぶ	df[[column, column2, column3, column4]]
グラフのフォントを日本語表示に設定する	sns.set(font='IPAexGothic')
データフレームとデータ列を横方向に連結する	pd.concat([df, ds], axis=1)
グラフを使う準備をする	import matplotlib.pyplot as plt
折れ線グラフをパウダーブルー色で描画する	plt.plot(データ列x, データ列y, color='powderblue')
棒グラフをフクシア色を用いて描画する	plt.bar(データ列x, データ列y, color='fuchsia')
リストに文字列を追加する	aList.append(element)
折れ線グラフの色をナバホホワイトに設定する	plt.plot(データ列x, データ列y, color='navajowhite')
散布図のポイントマーカーを青くする	plt.scatter(データ列x, データ列y, marker='.', markerfacecolor='b')
二つの浮動小数点数が十分に近いか確認する	math.isclose(x, x2)
option: シャルトリューズ色を使う	color = 'chartreuse'
黄色いグリッド線を引く	plt.grid(color='y')
データフレームのリスト列の欠損値を中央値に変更する	df[aList].fillna(df[aList].median())
２つのオブジェクトが等しい	obj == obj2
option: マーカーの色をハニーデューにする	markerfacecolor = 'honeydew'
イテラブルを累加したイテラブル	itertools.accumulate(iterable)
ダークシアグリーン色として散布図を描画する	plt.scatter(データ列x, データ列y, color='darkseagreen')
両端キューから最初の要素を取り除く	deq.remove(element)
文字列の中の大文字・小文字を無視して正規表現によるマッチを見る	re.findall(pattern, s, flags=re.IGNORECASE)
モジュールを検索するパス	sys.path
データフレームを列を用いてによって破壊的に並べる	df.sort_values(by=column, inplace=True)
文字列が全て空白文字からなる	s.isspace()
データフレームのリストカラムの中にいくつ欠損値があるか数える	df[aList].isna().sum()
散布図をビスク色として描画する	plt.scatter(データ列x, データ列y, color='bisque')
棒グラフをサドルブラウン色として描画する	plt.bar(データ列x, データ列y, color='saddlebrown')
option: オレンジ色を使う	color = 'orange'
nまでの偶整数列	list(range(2, n, 2))
リストとイテラブルの散布図に丸マーカーをプロットする	plt.plot(データ列x, データ列y, marker='o')
複数のデータフレームを横方向に連結する	pd.concat([df, df2, df3], axis=1)
ひらがなをカタカナに変換する	''.join([chr(ord(ch) + 96) if ('ぁ' <= ch <= 'ん') else ch for ch in s])
ヒストグラムをダークシアグリーン色として描画する	plt.hist(データ列, color='darkseagreen')
option: マーカーの色をライトグリーンにする	markerfacecolor = 'lightseagreen'
カウンタの最も頻出な文字列を求める	aCounter.most_common()[0]
原点から(実数,y)の距離を求める	math.hypot(x, y)
列と列をジップする	itertools.zip_longest(iterable, iterable2)
2つのデータフレームを横方向にマージする	pd.merge(df, df2)
折れ線グラフの透明度を変更する	plt.plot(データ列x, データ列y, alpha=0.5)
散布図の大バツマーカーを黒くする	plt.scatter(データ列x, データ列y, marker='X', markerfacecolor='k')
ホワイトスモーク色の線グラフを描画する	plt.plot(データ列x, データ列y, color='whitesmoke')
散布図をコーラル色で描画する	plt.scatter(データ列x, データ列y, color='coral')
浮動小数点数のn乗を求める	pow(x, n)
データフレームの中の列を四分位数ごとに分割する	pd.qcut(df[col], 4)
辞書をJSON形式の文字列に変換する	json.dumps(aDict, ensure_ascii=False)
散布図の▲印の線幅を指定する	plt.scatter(データ列x, データ列y, marker='^', markeredgewidth=2.5)
マップから項目名の値	aDict.get(key)
散布図を赤い右三角マーカーで描く	plt.plot(データ列x, データ列y, marker='>', c='r')
文字コードtextで追加できるように既存のファイルパスを開く]	open(filepath, mode='a', encoding=text)
データフレームの列の文字列が正規表現文字列にマッチする行を取り出す	df[df[column].str.match(s)]
折れ線グラフの色をゴールデンロッドに設定する	plt.plot(データ列x, データ列y, color='goldenrod')
タイムスタンプデータが何時か知る	aDatetime.hour
辞書の値として要素が含まれているか調べる	element in aDict.values()
option: 改行をセパレータで使う	sep = '\n'
タプルをミュータブルにする	list(aTuple)
