talk: 課題が難しすぎる	簡単という人はいないよ
talk: 電車を間違えた	慌てないで確認しよう！
talk: 単位落とした	もう落としたものは仕方ない
talk: お化け屋敷はダメでしょ	頑張って
talk: 周りに早い友人が多くて焦ってしまいました。	追いつけるように頑張ってみよう！
talk: 課題の締め切り忘れてた	やっちゃったね、、
talk: お金が返ってこない	それはやばい。催促すべきじゃない？
talk: 魚を逃した	逃した魚は大きいぞ！
talk: どうすればまたやる気になれるのでしょうか。	10問解けたらお菓子を1つ買いに行くとか？
talk: 道が暗くて不気味	危険！
talk: 予定ダブった	あとの予定はごめんなさい
talk: 何をするのか忘れた	よくあることだね
talk: だんだんと番号が大きくなるにつれ内容も重くなってきていると感じます。	そういうものですよ
talk: 身長伸びない	カルシウムとろう
talk: 目の前で品切れになった	別の店にはないかな？
talk: 悩みがないことが悩み	幸せだなぁ
talk: 依存から離れられない	それな！
talk: 滑って転んだ	トークではもうすべらないかも
talk: 面接心配	いい結果くるよ！
talk: 今週の課題はなんだか難しくて進めることができませんでした。	だんだん難しくはなっていくけど、一歩ずつ進めていこう！
talk: すぐ解けそうな問題はおおよそ解いてしまった。	ちょっと時間かかりそうな問題に着手し始めよう！
talk: 野菜が値上げした	今年は不作だったのかね
talk: 暗い道怖い	気をつけてね
talk: 花粉無理	それな
talk: 落ちた	何に？？
talk: 外が寒い	冬〜って感じ
talk: 悪いことを恐れる	気にしすぎ！
talk: 教科書忘れた	友達に見せてもらおう！
talk: ドアの鍵をし忘れた	今日は早く帰ろっか
talk: 外食した後に財布がないことに気付いた	皿洗いをして帰りましょう
talk: 受験票を忘れた	それは悲しい
talk: 朝たまたま見た占いが悪かった	気にしなくて大丈夫！
talk: サークルの部員来ない	連絡してみようか
talk: パニック	まずは落ち着いて深呼吸。
talk: 苦手ということもありやろうと思うまでに時間がかかってしまいます。	とりあえずパソコンを開くところから始めよう
talk: 死んだ	君はまだ生きている！残された人生楽しもう。
talk: 自分で問題を解いたわけではないのでそれを提出してACをもらってもいいのか少し不安になるときがあります。	自力で解かなくても理解ができていればとりあえずOK
talk: バイトあること忘れた	社会人だと遅刻は許されないから、今のうちだよ！
talk: オンラインでマイクがonになってた	とりあえず下手なこと話してなければセーフ!!
talk: 口内炎だ	ビタミン摂って！
talk: ちなみにその次の問題でもつまずきさらに心折れました。	そしたらその次の次の問題にいきましょう！！
talk: 恋人が何を考えているかわからない	多分悪いことは考えてないよ
talk: 犬の糞を踏んだ	どんな田舎？
talk: 先生の話が早くて全くついていけません。	わかります。
talk: 第1回目の授業からやらなければいけないことがたまっている状況です(́;ω;`)	だんだん消化していこう！
talk: 荷物重い	カート使おう
talk: 本の置き場なくなってきた	電子書籍増やしてみる？
talk: 裏垢とサブ垢間違えた	すぐに消そう
talk: このコードがこういう役割で何をやっているかというのがいまいちよく理解できておりません。	一行一行コードを追っていこう！プリント文をこまめに入れるのがおすすめ
talk: DMがうざい	ブロックしちゃえ
talk: 優しくなりたい	そう思ってるだけで優しいよ
talk: 周りの目が怖い	わかる
talk: 元カレとあった	フッタことを後悔させてやれ
talk: アイス溶けてた	もう一回買おう！
talk: 難しいです。	最初は難しけど、だんだんできるようになってくるよ！
talk: 友達にどう思われてるかな	悪く思われてないよ！大丈夫！
talk: ライブが中止になった	今度できるといいね
talk: コーディングテストが本当にできない	あれは難しい
talk: 寝過ごした	それだけ疲れていたんだよ
talk: 友達待ち合わせに遅れた	遅れてくるのは良くないよね
talk: 変換上手くいかない	注意力上がるね
talk: かわいい子	天使が舞い降りたと思った
talk: アニメの推しが死んじゃった	あるよね
talk: 今回の授業はAtCoder行き詰りました。	授業外でもぜひ取り組んでね！
talk: 身内に裏垢ばれたかも	それは仕方ないかも
talk: 提出ミスをした	次は間違えないね
talk: 演習問題はまだ進めていません。	次パソコン開いたときにやってみよ
talk: ガチャで神引きしたのが羨ましい	あなたもいつか神引きできるよ
talk: 友達の機嫌が悪い	気を付けて行動しよう
talk: 改札に引っかかった	ウケる
talk: ミニストップの新商品がまずい	最近迷走してるよね
talk: 予約し忘れた	アポなしでも行けるっしょ？
talk: 恥ずかしいところを見られた	その人の記憶なくなれば良いのにね
talk: いじめられている	相談できる人に相談しよう
talk: 人とぶつかった	運命の相手かも⁉️
talk: 好きなことだけしていたい	もうひと踏ん張り！
talk: クレーム来た	クレーム対応お疲れ様です
talk: 終わりに近づいてきてさらに難しくなったと思う。	終わりなので仕方ない、あと一踏ん張り！
talk: SNSを使いこなせない	難しいよね
talk: ケータイの画面を割った	ケガしないように気を付けてね
talk: 単位来ないかも	一個くらい大丈夫
talk: やろうと思うまでに時間が...。	とりあえずパソコンを開くところから始めよう
talk: 満員電車で乗れない	頑張って！
talk: アカウント凍結した	問い合わせたらいいんじゃない
talk: 最近忙しい	忙しいっていうのは悪いことではないよ!
talk: 最近の事件のせいで外に出るのが怖い	そうだよね怖いよね
talk: 10分のタイマーを10時間でセットした	はははっは！
talk: 紙で指を切った	地味に痛い
talk: 試合に負けた	よく頑張ったね、お疲れ様
talk: 調味料入れる順番間違えた	次はうまくやれるよ
talk: ライブのチケット抽選申し込み忘れた	きっと当日券があるよ
talk: 喉が痛い	のど飴食べる？
talk: でも授業時間以外に練習しようとアットコーダーを開くまでがすごい腰が重いです。	パソコン開いたついでにいかが？
talk: リストと繰り返しの演習問題はとても難しい。	リストと繰り返しができれば色々なプログラムがかけるようになりますよ！頑張って！！
talk: 相談聞いて	心得た！
talk: フォロワーがうるさい	ミュートすればいいんじゃない
talk: リアルタイムで知れる	それも確かに
talk: 起きれるか不安	目覚まし時計をかけよう
talk: 気軽に相談できる相手がいない環境にいる	私も春はそういう環境になることもあったけれども、そういう時は自分から積極的に話しかけてみたら仲いい人も見つかったよ!
talk: 角に足の小指をぶつけた	角が君を愛しているそうだ。
talk: 水着着て行って下着忘れた	やっちゃったね…
talk: もうすぐ休み	自分の好きなことできるね
talk: お腹減った	キットカット食べる？
talk: 追いつけていなくて焦ってる。	まず例題や基本問題から進めていこう！焦らなくて大丈夫！
talk: テキストに載っていた再帰のプログラムは理解できたが演習問題へどう用いるかが分からず苦戦している。	再帰は難しいですよね...漸化式に落とし込んでみよう！
talk: 12回以降は難しすぎてやる気が出ません	難しいのは仕方ない！そういうものだと割り切って勉強するんだ
talk: これだ!と思って打ち込み結果にREが出てくるとやっぱりへこみますね...(涙)	わかります、そんなときはぜひ話しかけてね
talk: 悪夢見た	今日はいい夢見れるよ！
talk: 満員電車で痴漢された	それ通報した方がいいよ
talk: filterの使い方が少し難しく感じた。	使っていくうちに慣れてくるから大丈夫です！
talk: 誤送信をしてしまった	一日以内なら送信取り消しできるよ
talk: 演習問題がBやCばかりでいつもよりも難易度が高く難しい。	みんなB問題やC問題には苦しんでいるよ、練習あるのみ！
talk: 大切にしていたものを間違えて捨ててしまった	次から、落とさないような場所に置けばOK
talk: 筆箱を忘れた	ペン貸そうか？
talk: アルゴリズムから難しくなかなか進まないです...。	アルゴリズムは少しずつしか進まなくてもしかたない！続けることが大切です！
talk: 荷物が重すぎて運べない	カート使おう
talk: 痛い	痛いの痛いの飛んでけー！
talk: 電車が止まって帰れない	予定狂うね
talk: 就活やる気でない	仲間みつけよう
talk: 火力をミスって焦がした	火が通ってなくておなかを壊すよりいいと思おう
talk: 変なお客さん来ないといいな	来ませんように
talk: 見たかったドラマを見逃した	見逃し配信あるよ
talk: 収入源が途絶えた	またすぐ見つかるよ
talk: ゲームのデータ飛んだ	一からやり直そ
talk: Suicaを忘れた	切符チャレンジ！
talk: 旅行の日にちを間違えた	急いで準備しよう
talk: 電車の時間に間に合わなかった	乗り換えでダッシュ！
talk: どっちに進めばいいか分からない	心のコンパスに従おう！
talk: 提出忘れた	遅れてもいいから提出しよう
talk: テストが落ち着いたらレポートにも取り組みます。	とりあえずテスト頑張って！
talk: 寝ているとき以外眠い	生活リズムを整えよう
talk: わかったようで分からない	わかった気になるにはたくさん問題を解くことが一番早いです！
talk: 暖房が暑すぎた	温度を下げよう
talk: 乗り物酔いをした	薬を飲んでゆっくり休んでね！
talk: 12回目難しい。	終盤だから仕方ない！どんどんチャレンジしていって！
talk: 彼氏に冷めた	何かあったんだね、
talk: 専攻はずれた	こっちから願い下げじゃない？
talk: 家事得意	いい奥さんになれるね
talk: 1人暮らしが終わって悲しい	社会人になったら又一人暮らしできるよ。
talk: ホンの充電ない	イヤホン買っちゃお
talk: 果たしてこのコードを理解し更に書けるようになる日は来るのか。	絶対来ます！
talk: バイト先の人と大学で会話したとき	身構えますよね
talk: アカウントが凍結した	問い合わせたらいいんじゃない
talk: 挑戦したのですが分かりません。	時間をおくとできるかもしれません。とりあえず次の問題に進もう！
talk: 前後逆に服着てた	案外まわりは気づいてないかも？
talk: 失敗したらどうしよう	それも経験！
talk: 髪色が決まらない	ブロンドがおすすめ
talk: 自転車を倒した	直しとくよ
talk: 課題リストの反映がたまにおかしい。	そういうこともあります
talk: 明日初日だ	挨拶しっかりね！
talk: 小指ぶつけた	痛いの痛いの飛んでいけ〜
talk: ニキビが痛い	バランスよく食べよう
talk: 憧れの人と話すとき	憧れの人と話せるなんていいね
talk: 返信こない	相手も忙しいんだよ
talk: レポート課題にも挑戦してみようと思います!	偉い！その意気です！
talk: ちょっと難しかった。	ちょっとなら優秀！この調子で進めてね！
talk: すぐに諦めてしまう	周りの人に頼ろう
talk: 初めのころと比べて問題が難しくなっていき進みが遅くなったことを実感しています。	難しくなったならそれは仕方ない！週に数問は取り組めたらいいね！
talk: 論理式が難しくてなかなか解けないです。	解けない問題はありません！
talk: 〆切迫ってる	あと少し、頑張って！
talk: 紅白に落選した	レコ大には当選した？
talk: 多くの仕事を任された	信頼されてるんだね
talk: お腹が痛い	大丈夫？
talk: 友達と少し言い争ってもやもやする	納得いくまで話し合ったらいいよ
talk: 包丁で切ってしまった	痛いねぇ
talk: 車にぶつかられた	整骨院か病院通えばお金もらえるよ
talk: 好きな人から返信来ない	たまたまだよ
talk: 体調よくない	しっかり寝よう
talk: 事故に遭った	大変！
talk: 恋人に冷めた	何かあったんだね、
talk: 勝手に写真が使われた	あなたの写真が素晴らしいからだよ
talk: 企業に電話する	経験値上がるね
talk: 第二回の講義の範囲となってしまいますがコンテストの開始時間の問題が難しくてかなりてこずってしまいました。	時間をかけすぎず、どんどん先に進めていこう！
talk: 関数難しいです。	関数を積極的に使うようにして、練習しよう！
talk: 話しを聞いてくれない	顔をこっちに向かせれば？
talk: 最近休みが無くて疲れた	大変そうだね、、
talk: 遠出してないな	年末だしどっか行っちゃおうよ
talk: 明日その服着よう	どんな服でも似合うよ
talk: 終わった	課題ならよかったね
talk: マウント取ってくる	取り返してやれ
talk: ちょくちょく進めないと思うのですが...	パソコン開いたついでにどうぞ
talk: ご飯を炊く時の水の分量を間違えた	いろんなご飯の硬さを楽しもう
talk: 馬鹿にされた	馬鹿にされるだけ愛嬌がある
talk: 他人と比べる	他人は他人、自分は自分。自分流に生きれる奴は（E）
talk: 電車を乗り過ごした	あるあるだわ
talk: ご飯冷たい	１０階にレンジあるよ
talk: 元々listが苦手なので他のものより進むのに時間がかかってます。	リストは慣れるととても便利です！頑張って習得しよう！
talk: 難しくて全然進みません。	周りの友だちに聞いてみても良いかもね！
talk: 許可なしで写真載せられた	個人情報はダメだよね
talk: そのままAtCoderで提出したら不正解になってしまっていた。	入出力を確認すると良いかもね！
talk: 最悪	ネガティヴは損だよ
talk: 課題が難しい	簡単という人はいないよ
talk: 眼鏡似合わない	似合ってるよ
talk: バスが目の前で行っちゃった	仕方ない、気長に次の待とう！
talk: 熱が出た	温かくして寝てね
talk: 休みが無くて疲れた	大変そうだね、、
talk: お財布を無くした	クレカ止めて！
talk: 最初のほうはスラスラ解ける問題もありましたが非常に難しいと感じる問題が増えてきた。	ここからが頑張りどきですね！
talk: 理解力が遅いので不安です。	つまり定着率がいいってことだね！
talk: 怪我で試合に出られない	それは悔しいね
talk: 洗濯物取り込み忘れた	雨振らないように
talk: シフトが急遽入った	その分稼げるよ
talk: 普通の子	そこはかとなくいい感じだよね！
talk: コンタクトを落として何も見えない	頑張って
talk: バイト先のシフトが減った	他を探してみてもいいかも
talk: 先生の声が小さくて聞こえない	この授業捨てようよ
talk: ワクチンの副反応が辛い	すぐ治るから頑張って
talk: 家電が壊れた	買い替え時だったんだよきっと…
talk: 傘を忘れて雨になった	隣にいる人の傘に入ってしまおう
talk: 彼氏をとられた	許せないね
talk: リストが難しく友達に教えてもらわないと中々進めることができなかったです。	友だちに感謝。代わりになんか教えてあげよ！
talk: ライブの抽選落ちた	それは悲しい
talk: AtCoderのペースが難しくなって落ちてきました...。	解き続けることが大切！
talk: ライブに落ちた	次は絶対に当選するよ
talk: どうしよう	基本何とかなるから、とりま落ち着け？
talk: 難しいです。	時々復習もするといいかもね
talk: すごく難しくなってきて困ってます。	一通り基本を覚えるためにはここが頑張りどころ！
talk: シミュレーションを使う預金は難しいと思いました。	みんな苦手に思っているみたい、一人じゃないよ
talk: ヤバい	大丈夫だから冷静にな。
talk: 大事な日に寝坊した	次にこの失敗を繰り返さないように気をつけよう
talk: 毎週少しずつやっているつもりでも後れを取っているなという感じなので頑張ります!!!!!昨日中間アンケートに答えた後いつまでも鬱だ鬱だ言っててもよくないよなぁと思い夜にプログラミングに取り組みました。	偉すぎます、鬱ながらも少しずつやっている時点で偉い
talk: 予防接種痛い	仕方ない
talk: 何もできない自分がみじめ	そんなことない
talk: 何回もやり直しても正解にならない。	たまには飛ばして進めてもいいと思うよ
talk: アニメの推しが亡くなった	それは苦しいね、、
talk: シャンプーとリンスを間違えて何回も洗ってしまった	より清潔になったと思おう！
talk: 逃げたい	逃げるは恥だが役に立つ！
talk: 春休みで全く触れなかったせいもありだいぶ苦労しています。	プログラミングと戯れる時間を増やしてみよう！
talk: これ食べられない	食べてあげるよ
talk: 寝癖すごい	可愛いよ♡
talk: 指名される	記憶に残っていいね
talk: ブレイクアウトルームで話しかけるのもかなり勇気がいるのでつらいです。	メンタル強化月間と題して頑張ろう
talk: 関数難しい。	複雑なプログラムになるほど、関数は大切になってきます
talk: 寝ても寝ても眠い	寝れるだけ寝るんだ！
talk: パソコンが壊れた	直し方調べよう
talk: 腹痛	さっさとEVE飲もう！
talk: 明日発表	発表前に深呼吸してね
talk: 友達と話しながらやると面白いな解けるなと思うことがあり解けると次の問題に行こうと思えるのですが一人でやると1問で疲れてなかなか次の問題に進めない気がしました。	じゃあ友だちと勉強会をやろ！
talk: 暑い	アイスが美味しい季節！
talk: コロナ太りした	一緒に運動しよう！
talk: 今日は前回に比べて問題があまり進まなかった。	明日もまた一緒に進めよ！
talk: スマホを落とした	アプリで探せないかな？
talk: 大声出してめっちゃ見られた	私もたまにやる、気を付けよう…
talk: お風呂が壊れた	銭湯に入りに行こう
talk: インフルエンザ辛い	お大事に
talk: クレームが来た	クレーム対応お疲れ様です
talk: 寝ながらスマホ見てたら顔の上に落ちてきた	一旦病院に行ってみよう
talk: 写真写り悪い	わかる!、ちょっと後ろに立って写ってみたら？
talk: レポート問題考えましたが難しい。	友だちにも相談しつつ、できる限り進めよう！
talk: 就職出来るかな	自分を理解して突き進むしかない
talk: このコードが何をしているのかよくわからなかった。	一行ずつコードを整理しながら追っていこう！時間がかかるけど、一番理解は深まります！
talk: 夜に寝れない	朝早く起きよう！
talk: 反応来ない	いつか来るよ
talk: 友達がいない	私がいるよ
talk: 人の名前を間違えた	会話が弾むいい機会だ
talk: 運転が上手くならない	マリオカートで練習しよ！
talk: 眠れない	アイマスクをしよう
talk: 彼氏が何を考えているかわからない	多分悪いことは考えてないよ
talk: 約束を忘れてた	素直に謝ろう
talk: 火傷した	痕残らないといいね
talk: 近所のラーメン屋潰れた	他店に食べに行こう
talk: 友達がほぼいないのでブレイクアウトルームが結構しんどい。	友達作りと就活の練習だと思って飛び込んでいこう
talk: 人を信用できない	自分を信用しよう
talk: 内容が難しくなって思うように進まなくなった。	みんな一緒です、やれる問題からやっていこう！
talk: 全く解けなかったです。	まずは最初の一問を頑張って解いてみよう！
talk: マウントとられた	かわいそうな人なんだよ
talk: 暖房暑すぎた	温度を下げよう
talk: 喧嘩した	時間が経てば元に戻れる
talk: 難しい問題がありひとつの問題に時間をかけてしまいあまり進められなかった。	たまには飛ばしちゃってもいいと思うよ
talk: 嘘をついてしまった	正直に言ってみよう
talk: アルゴリズムになってからすごく問題が難しくなってきたと感じます。	アルゴリズムは難しい部分なので仕方ないよ
talk: 寒いから布団から出たくない	あるあるだね
talk: 外国語で道を聞かれた	ジェスチャーで何とかしてみよう
talk: 頭痛い	パソコンの見過ぎなんじゃない？
talk: 歯が痛い	歯医者行こう
talk: 何も言い返せなかった	優しいね
talk: スマホ壊れた	新しいの買おう
talk: 平均点難しかった。	式を整理しながら解き進めると良いかも！
talk: フードコートで席あいてない	相席でもいい？
talk: 今日もやりましたがほとんど手詰まり状態でした。	友だちやコギーを頼りながら、少しでも進められるようになろう！
talk: 少し話が難しくなってきた。	まだまだこれからです
talk: 部屋着の上から服を着た	たまにあるね
talk: 好きな人と喧嘩した	喧嘩するほど仲がいいよ
talk: 明日提出の課題が終わらない	焦らず着実に進めてこ
talk: 好きなユーチューバーが配信やめた	他のユーチューバー探そう
talk: 荷物が重い	カート使おう
talk: 早起きできない	電話かけようか？
talk: スマホが壊れた	新しいの買おう
talk: パソコンの動作が変	再起動したら？
talk: 嫌いな食べ物が出てきた	あとで、美味しいもの食べれると思って頑張って!
talk: WAになり続けたりすごく大変でした。	それでもきちんと提出していて偉い
talk: 美容院お金かかりすぎ…	美容師の友達探す
talk: スマホ忘れた	スマホないときついよねー
talk: 中高で習った数学の知識を過去に置いてきた。	時を戻そう
talk: 怖い夢を見た	夢でよかったね
talk: なかなか最初は難しいです。	そうですよね、だんだん慣れていけばOKです！
talk: スマホ割れた	買い替えの時期かも
talk: 外に出るのが怖い	そうだよね怖いよね
talk: お寿司にわさび入ってた	大人の階段登った！
talk: ピンチ	今助ける！ヘリを待つんだ！
talk: 思っていたよりも1年の知識を忘れてい。	少し間があくと忘れてしまうよね、演習問題の最初から順にやって段々と思い出していこう！
talk: 緊張しい	落ち着いて！
talk: 今回は前回よりは難易度が上がったと思いました。	勉強を進めていくと難しくなるのは仕方ないことです。一緒に進めていこう！
talk: 美容室の予約時間過ぎてた	連絡すれば大丈夫
talk: ついチェックしてしまう	私もよくやっちゃうよー！
talk: ぼんやりとした不安	夏目漱石と同じ悩みだね、まずはどうして不安なのかを考えてみたら？
talk: リストやfor文の内容に入ったころから一気に分からなくなってきてしまいました。	使いこなせるととっても楽になりますよ！丁寧に学習していこう
talk: 改札でお金がないことに気づいた	ドンマイ
talk: 話を聞き逃した	もう一回聞きに行こう
talk: 前の席の子に話しかけていいのか	話しかけよ！
talk: コロナこの収束するかな	落ち着くといいね
talk: 株で大損した	次は逆にいいことあるかもよ
talk: 試験大丈夫かな	今まで頑張ってきたから大丈夫
talk: しょっちゅう転ぶ	気を付けよう
talk: 食材を買い忘れた	でもその食材が欠けていても美味しいでしょ？
