talk: 差ができていてやばい。	継続していくことが大切です
talk: 勉強するときにペンを忘れた	隣に座っている人に借りよう
talk: 難しいことが出来ない	わかる、
talk: サークルの部員が来ない	連絡してみようか
talk: 待ち合わせに遅刻した	すぐ謝ろう!
talk: インターン通らない	合わないってことであきらめな
talk: 将来どうなるだろう	やりたいこと見つけよう
talk: 何もできない自分にイライラする	そんなことない！
talk: 数学力が試された。	数学力はいる時もあればいらない時もあるよ
talk: 二日酔いが辛い	たくさん飲んだんだね、、
talk: テスト大丈夫だったかな	終わったことを気にするな！
talk: バスが目の前で行ってしまった	次のバスまで待とう
talk: 一生彼氏できない	そんな訳ない
talk: 水溜りに入った	水の滴るいい女になったね
talk: 1年生の時に関数は触れる程度でしか学習していないので6の関数から難しく授業時間内ではあまり進みませんでした。	まず関数の使い方を理解しましょう！なんとなくわかったらどんどん演習していこう！
talk: 単位欲しい。	課題進めればきっと単位もらえるよ
talk: 伝言を伝え忘れた	伝えに行かなきゃ
talk: クレーマーがきた	客だからって偉そうだよね
talk: 食パンかじって出かけたら角で人とぶつかった	漫画家よ！！！
talk: 祝日なのに休みじゃなかった	残念！
talk: がんばります...どんどん難しくなって進みもとても遅くなってます。	ゆっくりでもいいので進めることが大切です！
talk: 肩こりがひどい	大丈夫？ゆっくり休んで
talk: パスモを忘れた	切符チャレンジ！
talk: 忘れた	何を忘れたんだい？人間忘れる生き物さ。
talk: 部屋に虫がいる	怖すぎ
talk: ポーズ寒い	どんなポーズ？？
talk: 牛乳買い忘れた	ミルクティーが飲めない
talk: 一人	え、一人楽しくない？自由やで！
talk: チャレンジ問題から難しく感じた。	チャレンジだからね、仕方ない
talk: ColabではちゃんとできてもAtCoderではエラーになってしまう。	そういうこともあるよね、細かいところを確認してみよう！
talk: しかし第6回はあまり数をこなせなかったことが影響しているのか以前までは複雑な問題でもすぐに解法がひらめいていたのですが第6回はひらめきが若干遅くなった気がしています。	使い慣れていない文法が増えてきたからかもね、Google先生にも助けてもらおう
talk: 英語の先生めっちゃ当ててきた	why？
talk: 告白したい	当たって砕けな！
talk: 自転車で転んだ	大きなけががなくてよかった
talk: スタバの新作が売り切れてた	カロリー摂取抑えられたね
talk: 悔しいです。	来週からも頑張ろう
talk: 迷子になった	近くの人に道聞いたら何とかなる！
talk: 雨で服が濡れた	わかる！
talk: 充電コードを忘れた	貸すよ
talk: 親戚の人に久々に会うとき	久々に会う人はなんだか緊張するよね
talk: 鍵なくした	一緒に探そうか
talk: 指挟んだ	痛いね
talk: AtCoderは50(おつり)まで進みました。	その調子！どんどん進めていこう！
talk: ご飯食べるタイミング逃した！	早く寝て朝早く食べよ！
talk: 目の前で乗りたい電車のドアが閉まった	のんびり余裕をもって移動ができたね
talk: 告白するか迷う	悔いのないように！
talk: 怖い夢見た	夢でよかったね
talk: ゴールデンウィークはサボってしまって全然進みませんでした。	休み明け気合を入れ直そう！
talk: 唐辛子が辛すぎる	チーズ入れるといいよ
talk: 夜更かししちゃう	昼夜逆転わかる
talk: 目にゴミ入った	洗い流してー
talk: 難しかった。	気のせいです！
talk: 怪我した	お大事に。
talk: アクセルとブレーキ間違えた	瞬発力！！
talk: 英語が出来る	石油王と結婚出来るんじゃない？
talk: スマホ中毒を頑張って考えていたのですが考えるべき例外が多すぎて挫折しました。	すぐコードにしないで紙を使って落ち着いて整理しよう！
talk: にらまれた	無視しよ
talk: 彼氏と別れた	次の出会いがあるよ
talk: 新発売のお菓子がコンビニ限定…	高いよね…
talk: リモコンがない	探そう
talk: お財布落とした	交番へlet'sgo！
talk: 今日提出の物があった	今から急いでやろう！
talk: お財布を落とした	クレカ止めて！
talk: 内容が懐かしいものばかりで自分やらなすぎだなと感じた。	記憶を呼び起こそう
talk: 上下関係が分からない	敬語使っておけばとりあえずはオッケー
talk: 教職のために後期も履修するつもりでいますが不安です。	プログラミングできると今後絶対いいことあるよ！
talk: チャレンジ問題が難しいです。	チャレンジなので仕方ないよ、どんどん進めよ！
talk: 迎えに誰も来てくれない	待ちぼうけの練習だ
talk: 途中からわからなくなったのを放置していた。	まず週一から始めよ
talk: やる気出ない	一旦休憩しよ！
talk: 明日はテストだ	最後まで足掻こう
talk: 試験が近い	自分を信じて
talk: 授業休講のこと知らずに学校来ちゃった	良い運動だ！
talk: 痴漢された	警察に突き出そう
talk: 待ち合わせの時間間違えた	次は気を付けよう
talk: お土産で買ったものが地元でも売っていた	お土産は思い出なんだから、そんなに落ち込まないで！
talk: 親に言われる	自分の人生なのに。
talk: 服決まらない	なんでも似合うよ
talk: やばい	いい意味？悪い意味？
talk: いいねもらえない	時間帯じゃない？
talk: 占い結果が悪かった	占いは非科学的なものが多いから、気にしなくて大丈夫！
talk: 定期なくした	もっとよく探そう
talk: 今日もつかれた	お疲れ様！
talk: 就活したくない	それな！！！
talk: 疲れて心が痛い	まずは、遊ぼう！
talk: 受験落ちた	頑張ってよかったと思える日が必ずくるよ
talk: 今週は全くすすんでない。	じゃあ来週は頑張ろう！
talk: お店が閉まってる	そんな時もあるよ
talk: 画面オフだと思っていたらオンになっていた	一旦何もなかったかのように退出しよう
talk: ピアス穴が膿んだ	お薬塗るといいよ
talk: 雇ってくれる会社あるかな	たぶんある
talk: 成功するかな	この世に男はたくさんいる
talk: 痩せれない	それな
talk: 次回からのアルゴリズムがとても不安です。	いまから不安がらなくてOK！
talk: 寝れない	アロマとか音楽とかどうかな？？
talk: 待ち合わせ時間間違えてた	次は気を付けよう
talk: 限界まで働いている	無理しちゃだめだよ
talk: 気持ち悪いコメントしてくる人がいる	きもいね無視しよう
talk: 親戚が病気になった	きっと治るよ
talk: スマホの画面割れた	ちゃんと修理できるといいね…
talk: 進路に迷う	自分を信じて！どの選択でも君次第！
talk: リストの範囲が難しく感じました。	リストは苦手な人が多い範囲です、丁寧に学習を進めよう！
talk: スイーツを食べられた	名前を書いておこう
talk: すぐ解けそうな問題はおおよそ解いてしまったのでペースが落ちそうです...。	ちょっと時間かかりそうな問題に着手し始めよう！
talk: テストの裏に気が付かなかった	表は全部解けたの？
talk: 間違えて資料消しちゃった	次はいいの作れるよ
talk: チャレンジ問題にも挑戦したのですが分かりません。	時間をおくとできるかもしれません。とりあえず次の問題に進もう！
talk: 甲子園を逃した	練習は無駄じゃないよ
talk: お菓子がおいしくてやめられない	おいしいからしかたない
talk: 目が痛い	一旦、休もっか
talk: 遅刻しそう	ゆっくりおいで
talk: 面接だ	頑張って！応援してるよ
talk: 悪寒がする	あったかくして寝よう
talk: また改めてwhile、for構文に苦手意識があると思いました。	だんだん薄れてくるから大丈夫！たくさん練習しよう！
talk: でも書ける気がしません。	そんなことない！
talk: 行きたいところに就職できるかな	なんとかなるよ
talk: バカにするように笑われた	それは嫌だね
talk: 悲しい	悲しいね！
talk: 良い言葉が出てこない	伝われば大丈夫だよ
talk: 自分は全然分かってないと落ち込みました。	最初から完璧にわかる必要なんてないよ！友だちと確かめ合ってみてもいいかもね
talk: 乾燥して手が痛い	ハンドクリーム塗らないとね
talk: すっぽかした	そことは縁が無かったんだよ
talk: 最近1問解くのに時間がかかってなかなか進みません。	解き切ることが大切です！
talk: 思うようにいかない	人生甘くないんやで！
talk: 来週模擬授業だ	頑張れ
talk: 靴下がバラバラだった	それはそれであり
talk: これでできたか?と思ってもエラーになってしまってなかなか苦戦しています。	色々な入力を試してみよう！
talk: ゲーム機が壊れた	それは最悪だね、データとか大丈夫？？
talk: フォロワー増えない	そのうち増えるよ
talk: 実行時エラーや不正解の連続で心が折れてしまいそうです。	エラーならコギーが助けになれるかも！
talk: Twitterで悪口書いた	それはやめときな！
talk: 納期を間違えた	何の仕事中？
talk: 空いた時間に演習問題を少しずつ進めよう。	とてもよい心がけ！
talk: B問題が多くいつもより進みが遅くなってしまいました。	B問題は難しいので仕方ない！だんだん慣れていこう
talk: 独り暮らしを始めた	徐々に慣れていくよ
talk: 本を読むのに飽きた	新しいこと始めよう
talk: ジュースこぼした	(･᷄∀･᷅)
talk: パソコンのデータが消えた	なんとか復旧できないかな、、、
talk: 返信に時間が取られる	大事なメッセージだけ返せばいいよ
talk: 他人と気が合わない	それも個性さ
talk: やばいやばいと思いつつ全然進めない自分が嫌になります	パソコン開いたついでにコギーに会いにおいで
talk: 賞味期限切れていた	買ったらすぐ食べよう
talk: 映画を見た	次は一緒に見よ
talk: 切符を無くしちゃった	駅員さんに言えば大丈夫だよ
talk: こけた	誰も覚えてないよ
talk: マスクが嫌だ	マスクはコロナにとても効果があるんだよ
talk: 友達と喧嘩した	仲直りできるといいね
talk: かなり難しいあきらめました。	1週間後には突然解けるようになっているかも
talk: 学校の遠隔用の教室でzoomを受講しているのだが全員静かに授業を聞いているのであまり声を出せる環境ではなくて困っている。	ラウンジとかもおすすめ！
talk: かなり遅れているので不安ですが頑張ります。	そんなことないし、まだまだこれからだよ！
talk: アイディアを貰った	その考え神かよ
talk: あまり進められてないので焦ってます。	一週間で解く問題数を決めるといいかもね
talk: だんだん問題が難しくなっていく中での正解問題数が38なのでペースが周りより遅いことはわかっていたのですが不安が大きくなってきました。	毎週少しでもいいので解き進められるといいね！
talk: 部屋汚い	片付けよう！
talk: 内容が難しい。	プログラミングって奥深い
talk: バイトでお客さんに水かけた	謝ったら許してくれるよ！
talk: 友達の名前を言い間違えた	間違えた！って言ってみよう
talk: 改札引っかかった	ウケる
talk: バイト行きたくない	お金のために頑張ろう
talk: 食べたものが消費期限切れだった	変な味しなかった？
talk: 好きな人今誰といるのかな	きっと家で寝てるよ
talk: テストで0点とった	次がある！
talk: 結婚相手がいない	探す手段はたくさんあるので試しましょう
talk: シフト入ってないのにバイト行っちゃった	そんな日もあるよ！
talk: 友達が数日休んでいる	心配だね
talk: 体調がよくない	しっかり寝よう
talk: 課題を出し忘れた	説得して提出させてもらおう
talk: 終わりに近づいてきてさらに難しくなった。	終わりなので仕方ない、あと一踏ん張り！
talk: あまり進みませんでした。	明日から頑張ろう
talk: 今日誕生日なのに誰にも祝ってもらえなかった	誕生日おめでとう！！
talk: 眼鏡なくした	もう一回落ち着いて探そう！
talk: 課題が同時にたくさん出た	無理はしないでね
talk: 第9回の問題がCが多くて苦戦し時間がかかってしまいました。	少しでも多く解けるように頑張ろう！
talk: リストのところをやっているのですがとても難しく感じました。	全部解き終わった頃にはちょっと難しいくらいになってるよ
talk: だんだん問題が難しくなっていく中での正解問題数が38なのでペースが周りより遅いことはわかっていたのですが不安が大きくなってきた。	毎週少しでもいいので解き進められるといいね！
talk: 新しい服買った	似合ってるよ
talk: いつも難しいなと思っていましたが関数はやはりもっと難しくエラーをたくさん繰り返しました。	関数の引数や返り値を意識しよう！
talk: チケットが外れた	きっと次は当たるよ
talk: 卒業ラッシュすごい	みんなずっといて
talk: 授業の解説時間が長くなっていき難しくなってきたな。	解説時間短くしてもらおうか？
talk: 相手が遅刻してきた	注意しよう
talk: バック忘れた	よくあるよね
talk: 道がわからない	ググって
talk: 半袖は寒すぎた	早くカフェ行こ
talk: 先生に怒られた	あなたが悪いとは限らない！
talk: 写真を撮るの難しい	たくさん撮ろう
talk: 課題あるけどドラマの続き見たい	ちょっとだけ見ちゃう？
talk: バイトでミスしないかな	きっと大丈夫！
talk: 第一志望に落ちた	他の大学でもきっといいことが待ってるはず
talk: 入力例を試して出力例が正しく出たとしても実際提出するとWAで返ってくることが今回の第9回の演習問題では特に多く苦戦しています。	コーナーケースをじっくり考えてみよう！
talk: ばいばい	またね
talk: 炊飯器のスイッチ入れてなかった	ご飯はもうちょっと待とう
talk: 課題の締め切り間違えてた	やっちゃったね、、
talk: フォロワーが増えない	そのうち増えるよ
talk: 車に煽られた	落ち着いて離れよう
talk: 社会人人生不安	Me,too
talk: リップ塗っても乾燥する	本当にそれな
talk: イルミネーション見に行きたいのに混んでる、	混んでるときに行った方が味があるよ
talk: コンタクトなくした	裸眼の世界を楽しもう！
talk: 手越くん卒業しちゃった	しちゃったね
talk: エラーになってしまってなかなか苦戦しています。	色々な入力を試してみよう！
talk: 振り返ってみるとびっくりするほどややこしいやり方で解いていて後悔した。	振り返るのはとても良いことですね！次から気をつければOK！
talk: 必要とされていない	そんなことはないさ！
talk: 食べたいものが多すぎて辛い	運動すれば大丈夫
talk: 足つった	痛いよね
talk: 情報取集たくさんできる	それはいいこと！
talk: 部屋の電気消さずに家でちゃった	あるある
talk: 早く帰りたい	残ることでできる人間関係もある！お疲れ様
talk: 部屋にゴキブリが出た	怖すぎ
talk: 問題でつまずきそこで心折れました。	そういう時はどんどん新しい問題にチャレンジしていきましょう！
talk: スマホの動作が変	たまにあるよね
talk: チケットの抽選期間終わっていた	きっと運が溜まっているよ！
talk: 冷たい飲み物が売り切れ	地味に辛い
talk: ミュートし忘れて悪口言っちゃった	一旦何もなかったかのように退出しよう
talk: 注文を言い間違えた	言い直せば大丈夫！
talk: list使うの苦手です...。	リストは使用頻度高めなので、ぜひ練習してください！
talk: やらかした	君が思っているより、他人は何とも思わないぜ？気にせず挽回が大切。
talk: ペン忘れた	スマホかパソコンでメモしよう
talk: 少し話が難しくなってきました。	まだまだこれからです
talk: 寺田蘭世さんが芸能界から引退しちゃう	悪いニュースだね
talk: 問題がなかなかうまくいかず悩みました	悩むのも一つの勉強です
talk: 友達に会えなかった	明日はきっと会える！
talk: for文や演算系(+=など)を使うべき問題が難しかった。	使うべきだと気付いただけでもオッケーです！スラスラ書けるようになるとなお良いね！
talk: 泥棒が来るかもしれない	ちゃんと鍵を閉めていれば入ってこないよ!
talk: 犬が脱走した	追いかけよう！！
talk: やっと1週目の課題が終わりました...!長かったですね	お疲れさま！長い戦いです
talk: 特定の人にだけ引用リツイートされる	ブロックしちゃえ
talk: ハブられた	私がいるよ！
talk: 家計簿の計算が合わない	おかしいな
talk: なかなかアルゴリズムになってから思うように進まない。	完璧に書けるようになるには結構時間かかります、頑張って！
talk: 別れたい	よーく考えてから決めればええ。
talk: 好きな人に彼氏ができた	あの人イマイチだったよ！他にいい人いるよ！
talk: 下着一泊分忘れた	新しいものを買ういい機会だ
talk: インターン忘れてた	そこまでの会社だったってことだよ
talk: バカ丸出し	バカの方が楽しいよ！
talk: 蚊に刺された	ムヒ！
talk: 友達はもう30問目に進んでいると聞き少し焦り始めてきました。	その友だちがすごすぎるんだよ、自分のペースで進めてね！
talk: 見ていて寒い	暖かそうな服をおすすめしよう。
talk: 課題が終わらない	徹夜だ！！
talk: 鍵忘れた	忘れないように玄関に置こう
talk: 預金が難しい。	紙とペンを使って問題を整理してみよう！
talk: 寝ぐせついたままだった	なおせそう？
talk: 友達に気の利いた声をかけてあげられない	あなたは十分できてるよ
talk: トイレにスマホを忘れた	まだあるといいね
talk: 今週の課題はなんだか難しくてあまりスムーズに進めることができませんでした。	だんだん難しくはなっていくけど、一歩ずつ進めていこう！
talk: ダイエット続かない	なかなか難しいよね、、
talk: 混雑に巻き込まれた	時間をずらそう
talk: 返信がこない	相手も忙しいんだよ
talk: 勉強したくない	頑張ったら良いことあるんじゃない？
talk: 課題が終わらない	焦らず着実に進めてこ
talk: うんち踏んだ	運がついてくるよ
talk: 今日の夕飯何つくろうかな	自炊してるのえらい！
talk: 今回の範囲は難しく進まなかった。	まず1問！
talk: 自転車がパンクした	徒歩帰宅？
talk: かなり時間がかかってしまった。	それだけ長い時間プログラミング練習していて偉い
talk: 炭酸が爆発した	強い炭酸ってことが分かったね
talk: Twitterでポエム書く人痛い	地味にそのポエム響いたりするよね
talk: 問題自体はクイズみたいでアルゴリズムを考えつくことは比較的容易なのですがコードで表現する部分に苦戦しています。	クイズみたいって思えるんだね！楽しそう！コードはパターンをいくつか覚えておくと楽に書けるようになるかも！
talk: 新学期が始まる	楽しんでいこう
talk: 数回前の授業から既に授業きついていけていませんでした。	ぜひ復習を！
talk: 全然わからない	私も分からない！おそろいだね！
talk: 日焼けした	それは痛い
talk: 実験レポートを忘れた	そんな時もあるよ
talk: V6が解散した	寂しいね
talk: 満員電車に乗ってしまった	嫌だよね
talk: 予約忘れてた	今からでも間に合うかもしれないよ
talk: 転んでズボンが破けた	ええええええぇ！？どんな状況？？！
talk: 前回より少しだけ進んだ気がします。	応用なので仕方ない！少し時間を空けてもう一度チャレンジしてみよう！
talk: 他の方の回答をみてみるとそんなに簡単にできるのか!と思う。	そうやって他の人の回答を見るのも一つの勉強です！
talk: ニキビできた	皮膚科行こ
talk: 今日もAtCoderをやりましたがほとんど手詰まり状態でした。	友だちやコギーを頼りながら、少しでも進められるようになろう！
talk: 自分より才能がある人に嫉妬する	少しずつ努力しよう
talk: 写真写り悪くて載せれる写真ない	風景とか載せとけ
talk: 電車に乗り遅れた	乗り換えでダッシュ！
talk: 短気かも	すぐに熱くなれるんだね
talk: テスト赤点	知ってた？アインシュタインは物理の成績悪かったんだよ！あれ、ガリレオだっけな？
talk: お申し出受けた	堂々としてれば大丈夫
talk: アルゴリズムはやっぱり難しいです。	アルゴリズムはまず知識を身につけないとね
talk: プログラミング苦手で結構難しかったです。	だんだん慣れてくるはずです！頑張って！
talk: 郵便が届かない	気長に待ってみよう
talk: 近所のラーメン屋が潰れた	他店に食べに行こう
talk: 自分が不愛想だと思う	不愛想じゃないよ
talk: 今週の講義はとても難しくてまだしっかりと理解できません...。	こまめな復習や演習をお忘れなく！
talk: メイクが上手にできない	youtubeで勉強しよう
talk: 食べられないものがある	それだけ残そう
talk: 服逆だった	まじか、気づかなかった
talk: 一問あたりにかかる時間が長くなってきました。	解き切ることが大切！
talk: 野菜嫌い	無理しない程度に慣れよう
talk: 1年のプログラミング実習の成績が悪く少し不安です。	今年から頑張ればいいんだよ
talk: 腰痛い	大丈夫？重いものとか持たないようにね！
talk: 新入生の名前と顔が一致しない	覚えようとしていることがすごい
talk: ご飯を食べ忘れた	次食べるご飯はおいしいだろうなあ
talk: 面接がむずかった	いい結果くるよ！
talk: フォロワーが伸びない	通信が重たくならずに済むね
talk: 友達に質問しずらくなってきた...。	向こうはそんなに気にしてないと思うよ
talk: ほかの中間試験が一通り終わったのでこの授業も本腰入れておこう。	ぜひお願いします
talk: 友達怒ってないかな	思い違いってことよくあるよ
talk: 好きだったドラマが終わってしまう	来クールにもっとハマれるドラマがあるかもよ?
talk: ズボンのファスナー開いてた	どんまい、気づいてない人も多いと思うよ
talk: 新しい服を買った	似合ってるよ
talk: 今日はよくミスをする	そんな日もあるよ!
talk: 達成できるか不安です...。	頑張るしかない！
talk: 家を出たら財布を忘れた	今日は一日ヒモになろう
talk: 授業長かった	お疲れ様！
talk: 今まで飛ばしていた問題を解いていたのですがそれも難しい。	あら、解けている友だちがいたらヒントをもらうといいかもね！
talk: c問題はやることが多くて大変です	C問題を解けるようになれたらすごい！
talk: 虫歯痛い	いよいよ歯医者に行く時だ
talk: お皿を割ってしまった	怪我がなくてよかった！手袋とかで滑らないように気をつけよう!
talk: 就職先決まるかな？	大丈夫！心配しなくて大丈夫だよ！
talk: ダンスが覚えられない	練習あるのみ！たくさん練習頑張って
talk: 結婚できるかな	きっとできるよ
